Bitcar.io,https://www.crunchbase.com/organization/bitcar-io,"Bitcoin, Blockchain, Racing, Software","Singapore, Central Region, Singapore","Asia-Pacific (APAC), Association of Southeast Asian Nations (ASEAN), Southeast Asia",2015-01-01,year,,,2018-01-31,6500000,SGD,4956523,Initial Coin Offering,6500000,SGD,4956523,,,
BitOfProperty,https://www.crunchbase.com/organization/bitofproperty,"3D Technology, Blockchain, Crowdfunding, Real Estate Investment","Singapore, Central Region, Singapore","Asia-Pacific (APAC), Association of Southeast Asian Nations (ASEAN), Southeast Asia",2017-07-03,day,,,2018-05-10,,,,Seed,,,,Seed,"Lifull, Startup Spaze",2
DDEX,https://www.crunchbase.com/organization/ddex-c48e,"Ethereum, Financial Services, Information Technology","Beijing, Beijing, China",Asia-Pacific (APAC),,,,,2018-03-06,2100000,USD,2100000,Venture - Series Unknown,2100000,USD,2100000,,"Initialized Capital, ZhenFund",2
Cardsmobile,https://www.crunchbase.com/organization/cardsmobile,"Loyalty Programs, Mobile Apps, NFC, Security, Wireless","Saint Petersburg, Saint Petersburg City, Russian Federation",,2012-01-01,year,,,2018-05-15,,,,Seed,,,,Seed,"Alfa-Bank, LANIT",2
KYND,https://www.crunchbase.com/organization/kynd,"Computer, Cyber Security, Network Security, Software","London, England, United Kingdom",European Union (EU),,,,,2018-03-12,1200000,GBP,1668597,Venture - Series Unknown,1200000,GBP,1668597,,CPP Group PLC.,1
Metronome,https://www.crunchbase.com/organization/metronome-a4ae,"Cryptocurrency, Financial Services","Chicago, Illinois, United States","Greater Chicago Area, Great Lakes, Midwestern US",2017-01-01,year,,,2018-06-25,12110500,USD,12110500,Initial Coin Offering,12110500,USD,12110500,,"Arbi Khodagholian, Block Ventures, Genesis One Capital",3
FOHAT,https://www.crunchbase.com/organization/fohat,"Blockchain, Energy Management, Renewable Energy","Curitiba, Parana, Brazil",,2017-05-29,day,,,2018-04-01,1775500,BRL,537460,Pre-Seed,1775500,BRL,537460,Seed,"Carlos Pacheco, SAFIRA ENERGIA, Startupbootcamp, Startupbootcamp Energy Australia",4
Clearway Group,https://www.crunchbase.com/organization/clearway-group,"Homeland Security, Security","Dartford, Kent, United Kingdom",European Union (EU),1995-01-01,year,,,2018-04-25,23000000,GBP,32052488,Private Equity,23000000,GBP,32052488,Private Equity,"Business Growth Fund, Santander UK",2
CoinBundle,https://www.crunchbase.com/organization/coinbundle,"Blockchain, Cryptocurrency, Financial Services, FinTech, Information Technology, Internet","Singapore, Central Region, Singapore","Asia-Pacific (APAC), Association of Southeast Asian Nations (ASEAN), Southeast Asia",2018-01-01,month,,,2018-04-01,300000,USD,300000,Seed,300000,USD,300000,Seed,"FundersClub, Y Combinator",2
Interchange,https://www.crunchbase.com/organization/the-picks-shovels-co,"Cryptocurrency, Financial Services","San Francisco, California, United States","San Francisco Bay Area, West Coast, Western US",,,,,2018-01-19,163000,USD,163000,Seed,163000,USD,163000,Seed,"Boost VC, GINCO Investments, Tyler Willis",3
VR-All-Art,https://www.crunchbase.com/organization/vr-all-art,"Art, Augmented Reality, Blockchain, Cryptocurrency, Marketplace, Museums and Historical Sites, Virtual Reality","Zug, Zug, Switzerland",,2018-01-01,year,,,2018-04-15,2000000,USD,2000000,Seed,2000000,USD,2000000,Seed,,
Altcoin Advisors,https://www.crunchbase.com/organization/altcoin-advisors,"Artificial Intelligence, Big Data, Cryptocurrency, Hedge Funds, Machine Learning","Manhattan, New York, United States","Greater New York Area, East Coast, Northeastern US",2017-05-01,day,,,2018-01-20,500000,USD,500000,Seed,500000,USD,500000,Seed,,
FRESCO,https://www.crunchbase.com/organization/fresco-60a9,"Art, Blockchain, Performing Arts","Zug, Zug, Switzerland",,2017-10-14,day,,,2018-06-06,5000000,USD,5000000,Seed,5000000,USD,5000000,Seed,,
Operem,https://www.crunchbase.com/organization/operem,"Blockchain, Internet, Real Estate","Seattle, Washington, United States","Greater Seattle Area, West Coast, Western US",,,,,2018-04-27,2530000,USD,2530000,Seed,2530000,USD,2530000,Seed,,
jollyclick,https://www.crunchbase.com/organization/jollyclick,"Advertising, Advertising Platforms, Artificial Intelligence, Big Data, Blockchain, Human Resources, Innovation Management, Private Social Networking, Project Management, Social Media, Social Network","Mende, Languedoc-Roussillon, France",European Union (EU),2016-11-22,day,,,2018-03-01,720000,EUR,883500,Seed,720000,EUR,883500,Seed,"Bpifrance, Nore Rinnesjö-Eckerberg, Reykur Förvaltning AB, Région Occitanie",4
Peoplewave,https://www.crunchbase.com/organization/peoplewave,"Blockchain, Human Resources","Singapore, Central Region, Singapore","Asia-Pacific (APAC), Association of Southeast Asian Nations (ASEAN), Southeast Asia",,,,,2018-05-31,2000000,USD,2000000,Series A,2000000,USD,2000000,Early Stage Venture,,
Deep Sentinel,https://www.crunchbase.com/organization/deep-sentinel,"Home Improvement, Home Services, Security","Pleasanton, California, United States","San Francisco Bay Area, West Coast, Western US",2016-01-01,year,,,2018-04-09,,,,Series A,,,,Early Stage Venture,"Basis Set Ventures, Bezos Expeditions, Lux Capital, Shasta Ventures, UP2398",5
Proactiveinvestors,https://www.crunchbase.com/organization/proactiveinvestors,"Cryptocurrency, Financial Services, Journalism, Publishing, Social Media","Sydney, New South Wales, Australia","Asia-Pacific (APAC), Australasia",2006-01-01,year,,,2018-01-22,3300000,GBP,4614687,Venture - Series Unknown,3300000,GBP,4614687,,Mobeus Equity Partners,1
Paym.es,https://www.crunchbase.com/organization/paym-es,"Cryptocurrency, E-Commerce, Electronics, Finance, FinTech, Information Technology, Marketplace, Messaging, Software","Kadikoy, Istanbul, Turkey",,2017-01-01,year,,,2018-03-05,180000,USD,180000,Seed,180000,USD,180000,Seed,"DAAL, Start-Up Chile, StartersHub XO",3
Fluence.sh,https://www.crunchbase.com/organization/fluence-sh,"Blockchain, Information Technology, Internet","San Francisco, California, United States","San Francisco Bay Area, West Coast, Western US",2018-05-01,month,,,2018-02-13,1000000,USD,1000000,Seed,1000000,USD,1000000,Seed,,
Aidcoin,https://www.crunchbase.com/organization/aidcoin,"Blockchain, Non Profit","Chiasso, Ticino, Switzerland",,2013-01-01,year,,,2018-01-17,6000000,EUR,7308267,Initial Coin Offering,6000000,EUR,7308267,,,
Regulus Cyber,https://www.crunchbase.com/organization/regulus-cyber,"Autonomous Vehicles, Computer, Drones, Enterprise, Security, Software","Haifa, Hefa, Israel",,2016-01-01,year,,,2018-04-26,5100000,USD,5100000,Series A,5100000,USD,5100000,Early Stage Venture,"Canaan Partners Israel, F2 Capital, Sierra Ventures, Technion - Israel Institute of Technology, The Junction",5
Risk Ledger,https://www.crunchbase.com/organization/risk-ledger,"Cyber Security, Network Security, Risk Management, Security, Supply Chain Management","London, England, United Kingdom",European Union (EU),2018-04-22,day,,,2018-03-01,15000,GBP,20662,Undisclosed,15000,GBP,20662,,"CyLon, Episode 1",2
WitFoo,https://www.crunchbase.com/organization/witfoo,"Computer, Cyber Security, Internet, Network Security","Atlanta, Georgia, United States","Greater Atlanta Area, East Coast, Southern US",2016-02-05,day,,,2018-03-03,126840,USD,126840,Equity Crowdfunding,126840,USD,126840,,"Kartheek Pulavarthi, StartEngine",2
Drone Energy,https://www.crunchbase.com/organization/drone-energy,"Bitcoin, Blockchain, Cryptocurrency","Amherst, New York, United States","East Coast, Northeastern US",2017-01-01,year,,,2018-04-03,1000000,USD,1000000,Seed,1000000,USD,1000000,Seed,,
Halon Security,https://www.crunchbase.com/organization/halon-security,"Cloud Security, Cyber Security, Information Technology, Internet, Network Security, Security, Software","Göteborg, Vastra Gotaland, Sweden","European Union (EU), Nordic Countries, Scandinavia",1999-01-01,year,,,2018-03-08,15000000,SEK,1813712,Venture - Series Unknown,15000000,SEK,1813712,,"Almi Invest, Chalmers Innovation, Leif Kristensson",3
Poleecy,https://www.crunchbase.com/organization/poleecy,"Artificial Intelligence, Auto Insurance, Blockchain, Commercial Insurance, Health Insurance, Insurance, InsurTech, Machine Learning, Property Insurance","Roma, Lazio, Italy",European Union (EU),2018-02-02,day,,,2018-04-20,300000,EUR,369378,Seed,300000,EUR,369378,Seed,,
CryptoMKT,https://www.crunchbase.com/organization/cryptomkt,"Bitcoin, Blockchain, Cryptocurrency, Ethereum, Financial Services","Las Condes, Region Metropolitana, Chile",,2016-11-30,day,,,2018-05-14,600000,USD,600000,Seed,600000,USD,600000,Seed,"ConsenSys Ventures, Magma Partners",2
Dominode,https://www.crunchbase.com/organization/dominode,"Blockchain, Identity Management, Information Technology, Mobile, Mobile Apps, Privacy","Boca Raton, Florida, United States","Greater Miami Area, East Coast, Southern US",2017-07-19,day,,,2018-01-26,1300000,USD,1300000,Angel,1300000,USD,1300000,Seed,Blockchain Ventures Corp,1
Poseidon Foundation,https://www.crunchbase.com/organization/poseidon-foundation,"Blockchain, Consumer Software, Retail Technology","Liverpool, Liverpool, United Kingdom",European Union (EU),2017-09-19,day,,,2018-06-16,2100115,EUR,2440376,Initial Coin Offering,2100115,EUR,2440376,,,
RAISON,https://www.crunchbase.com/organization/raison-bb3a,"Artificial Intelligence, Cryptocurrency, FinTech, Machine Learning","Tallinn, Harjumaa, Estonia",European Union (EU),2017-01-01,year,,,2018-04-15,135000,EUR,166488,Convertible Note,940345,EUR,1107048,Seed,Raison Asset Management,1
Rencore,https://www.crunchbase.com/organization/rencore,"B2B, Cloud Security, Cyber Security, Enterprise Applications, SaaS, Security, Software","Munich, Bayern, Germany",European Union (EU),2013-06-15,day,,,2018-01-15,1500000,EUR,1840018,Seed,1500000,EUR,1840018,Seed,,
Groupdolists,https://www.crunchbase.com/organization/groupdolists,"Security, Software","New York, New York, United States","Greater New York Area, East Coast, Northeastern US",2012-01-01,year,,,2018-01-25,1500000,USD,1500000,Seed,1500000,USD,1500000,Seed,"Bruce Blythe, Responder Ventures, Selig Zises",3
Rocketr,https://www.crunchbase.com/organization/rocketr,"Cryptocurrency, E-Commerce, Payments","Chicago, Illinois, United States","Greater Chicago Area, Great Lakes, Midwestern US",2016-07-01,month,,,2018-05-01,500000,USD,500000,Seed,500000,USD,500000,Seed,Bitmain,1
Geon Network,https://www.crunchbase.com/organization/geon-netwo,"Augmented Reality, Blockchain, Cryptocurrency, Mobile Apps, Mobile Payments","Gibraltar, Gibraltar, Gibraltar",,2018-01-01,month,,,2018-03-18,700000,USD,700000,Seed,700000,USD,700000,Seed,DataVentures.io,1
Hexel,https://www.crunchbase.com/organization/hexel,"Cryptocurrency, Productivity Tools, Software, Virtual Currency","San Francisco, California, United States","San Francisco Bay Area, West Coast, Western US",2017-01-01,year,,,2018-01-04,120000,USD,120000,Seed,120000,USD,120000,Seed,Y Combinator,1
Corrata,https://www.crunchbase.com/organization/corrata,"Apps, Enterprise, Information Technology, Mobile, Risk Management, Security","Dublin, Dublin, Ireland",European Union (EU),2014-01-01,year,,,2018-05-14,1300000,EUR,1551062,Venture - Series Unknown,1300000,EUR,1551062,,Delta Partners,1
INX,https://www.crunchbase.com/organization/inx-limited,"Cryptocurrency, Financial Services, Trading Platform","Gibraltar, Gibraltar, Gibraltar",,2017-09-01,month,,,2018-04-01,3500000,USD,3500000,Series A,3500000,USD,3500000,Early Stage Venture,SPiCE VC,1
Copernicus Gold,https://www.crunchbase.com/organization/copernicus-gold,"Blockchain, Financial Services, FinTech","Singapore, Central Region, Singapore","Asia-Pacific (APAC), Association of Southeast Asian Nations (ASEAN), Southeast Asia",2015-01-01,year,,,2018-02-14,3500000,USD,3500000,Venture - Series Unknown,3500000,USD,3500000,,,
ZG.com,https://www.crunchbase.com/organization/zg-com,"Blockchain, Information Services, Information Technology","Beijing, Beijing, China",Asia-Pacific (APAC),2018-01-01,year,,,2018-06-22,20000000,USD,20000000,Series A,20000000,USD,20000000,Early Stage Venture,"Happy East Capital, Sky9 Capital",2
AlloVoisins,https://www.crunchbase.com/organization/allovoisins,"Computer, Network Security, Rental","Rezé, Pays de la Loire, France",European Union (EU),2013-01-01,year,,,2018-02-08,3000000,EUR,3678251,Venture - Series Unknown,3000000,EUR,3678251,,"RTL Group, Verdoso Media",2
Choice,https://www.crunchbase.com/organization/choice-a857,"Blockchain, Charity, Impact Investing, Mobile Payments, Payments, Social Entrepreneurship","Wellington, Wellington, New Zealand","Asia-Pacific (APAC), Australasia",2017-10-01,month,,,2018-03-28,1000000,NZD,721199,Grant,,,,,NEM,1
NUTS Technologies Inc.,https://www.crunchbase.com/organization/nuts-technologies,"Cyber Security, Information Technology, Privacy, Security","Glencoe, Illinois, United States","Greater Chicago Area, Great Lakes, Midwestern US",2016-01-01,year,,,2018-04-16,2300000,USD,2300000,Seed,2300000,USD,2300000,Seed,,
PhishLabs,https://www.crunchbase.com/organization/phishlabs,"Security, Software","Charleston, South Carolina, United States","East Coast, Southern US",2008-10-01,day,,,2018-05-11,20500000,USD,20500000,Venture - Series Unknown,20500000,USD,20500000,,"Anthony Prince, Fulcrum Equity Partners",2
BitCAD,https://www.crunchbase.com/organization/bitcad,"Biometrics, Cryptocurrency, FinTech, Security","Walnut, California, United States","Greater Los Angeles Area, West Coast, Western US",2015-12-02,day,,,2018-01-19,,,,Seed,,,,Seed,,
bron.tech,https://www.crunchbase.com/organization/brontech,"Blockchain, Cryptocurrency, Identity Management, Information Technology, Internet, Software Engineering","Sydney, New South Wales, Australia","Asia-Pacific (APAC), Australasia",2016-07-01,day,,,2018-01-31,66660,AUD,53724,Seed,66660,AUD,53724,Seed,"Artesian VC, BlueChilli, muru-D, Ookami Ltd",4
Cyberus Labs,https://www.crunchbase.com/organization/cyberus-labs,"Cyber Security, Information Technology, Security","Kraków, Malopolskie, Poland",European Union (EU),2015-01-01,year,,,2018-06-01,2827625,EUR,3299407,Grant,,,,,"EASME - EU Executive Agency for SMEs, Startupbootcamp",2
Project Shivom,https://www.crunchbase.com/organization/project-shivom,"Biotechnology, Blockchain, Cryptocurrency, Genetics, Health Care","Munich, Bayern, Germany",European Union (EU),2017-01-01,month,,,2018-05-21,35000000,USD,35000000,Initial Coin Offering,35000000,USD,35000000,,"Collinstar Capital, DigitalX Investments, Discovery Capital, Hoperidge Capital, Ironside Capital",5
BetterHealth.ai,https://www.crunchbase.com/organization/betterhealth-ai,"Artificial Intelligence, Blockchain, Cloud Data Services, Health Care, Machine Learning, Predictive Analytics, Wellness","San Francisco, California, United States","San Francisco Bay Area, West Coast, Western US",2018-06-01,month,,,2018-06-01,100000,USD,100000,Seed,100000,USD,100000,Seed,,
Cartesi,https://www.crunchbase.com/organization/cartesi,Blockchain,"Taipei, T'ai-pei, Taiwan",Asia-Pacific (APAC),2018-03-05,day,,,2018-05-21,150000,USD,150000,Seed,150000,USD,150000,Seed,"Artesian VC, Bigbang Angels, ChinaAccelerator, Serguei Popov, SOSV",5
WeTuring,https://www.crunchbase.com/organization/weturing,"Artificial Intelligence, Blockchain, Cryptocurrency, FinTech","Santa Clara, California, United States","San Francisco Bay Area, Silicon Valley, West Coast",2018-01-01,year,,,2018-02-01,2000000,USD,2000000,Seed,2000000,USD,2000000,Seed,Leyu,1
Shping,https://www.crunchbase.com/organization/shping,"Apps, Cryptocurrency, Database, Retail, Shopping","Melbourne, Victoria, Australia","Asia-Pacific (APAC), Australasia",,,,,2018-02-05,3000000,USD,3000000,Initial Coin Offering,3000000,USD,3000000,,,
Basis,https://www.crunchbase.com/organization/basecoin,"Cryptocurrency, Financial Services, FinTech","Hoboken, New Jersey, United States","Greater New York Area, East Coast, Northeastern US",,,,,2018-04-18,133000000,USD,133000000,Initial Coin Offering,133000000,USD,133000000,,"Andreessen Horowitz, Bain Capital Ventures, Lightspeed Venture Partners, Social Starts, ZhenFund",36
goFlux,https://www.crunchbase.com/organization/goflux,"Compliance, Information Technology, Marketplace, Software, Supply Chain Management, Transportation","São Paulo, Sao Paulo, Brazil",,2015-12-02,day,,,2018-02-01,450000,USD,450000,Seed,450000,USD,450000,Seed,,
BetterPlace Safety Solutions Pvt. Ltd.,https://www.crunchbase.com/organization/betterplace-safety-solutions-pvt-ltd,"Human Resources, Security, Training","Bangalore City, Karnataka, India",Asia-Pacific (APAC),2015-01-01,day,,,2018-05-22,3000000,USD,3000000,Series A,3000000,USD,3000000,Early Stage Venture,"3one4 Capital, Unitus Ventures, Venture Highway",3
Ben,https://www.crunchbase.com/organization/ben,"Bitcoin, Cryptocurrency, Internet","San Diego, California, United States","Greater San Diego Area, West Coast, Western US",2017-10-26,day,,,2018-01-04,120000,USD,120000,Angel,120000,USD,120000,Seed,Y Combinator,1
MATRIX Foundation,https://www.crunchbase.com/organization/matrix-foundation,"Blockchain, Intelligent Systems, Internet","Hong Kong, Hong Kong Island, Hong Kong",Asia-Pacific (APAC),2016-09-01,month,,,2018-01-29,15550000,USD,15550000,Initial Coin Offering,15550000,USD,15550000,,,
FundPlaces,https://www.crunchbase.com/organization/fundplaces,"Crowdfunding, Cryptocurrency, Real Estate, Real Estate Investment","Singapore, Central Region, Singapore","Asia-Pacific (APAC), Association of Southeast Asian Nations (ASEAN), Southeast Asia",2015-01-01,year,,,2018-01-03,2000000,SGD,1502999,Venture - Series Unknown,2000000,SGD,1502999,,Global Yellow Pages,1
TrackMyRisks,https://www.crunchbase.com/organization/trackmyrisks,"Compliance, Document Management, Risk Management, SaaS, Software","London, England, United Kingdom",European Union (EU),2014-05-20,day,,,2018-01-27,140600,GBP,199097,Seed,140600,GBP,199097,Seed,Nexus Investment Ventures,1
CryptoMove,https://www.crunchbase.com/organization/cryptomove,"Blockchain, Cloud Security, Cyber Security, Data Storage, Database, Enterprise Software, Internet of Things, Security, Software","Oakland, California, United States","San Francisco Bay Area, West Coast, Western US",2015-01-01,year,,,2018-02-12,6000000,USD,6000000,Series A,6000000,USD,6000000,Early Stage Venture,"Alchemist Accelerator, Draper Associates, Pathbreaker Ventures, Red Dog Capital, Social Capital",8
Herdius,https://www.crunchbase.com/organization/herdius,"Blockchain, Financial Services, Infrastructure","Berlin, Berlin, Germany",European Union (EU),2017-06-01,month,,,2018-04-04,201000,EUR,246976,Seed,201000,EUR,246976,Seed,KR1,1
AARNAV (ARM Token),https://www.crunchbase.com/organization/aarnav-arm-token,"Blockchain, Cryptocurrency, Data Mining, Real Estate, Real Estate Investment","Jericho, New York, United States","Greater New York Area, East Coast, Northeastern US",2018-02-22,day,,,2018-05-01,230000,USD,230000,Seed,230000,USD,230000,Seed,,
ATN.io,https://www.crunchbase.com/organization/atn-io,"Artificial Intelligence, Blockchain, Developer APIs, Enterprise Applications, Marketplace, Open Source","Shanghai, Shanghai, China",Asia-Pacific (APAC),2016-10-01,day,,,2018-02-08,10000000,USD,10000000,Corporate Round,10000000,USD,10000000,,"Capital Dynamics, Dream Chaser Capital, Longqing Investment, Waterdrip Capital",4
Tangany,https://www.crunchbase.com/organization/tangany,"B2B, Blockchain, Cloud Infrastructure, Cryptocurrency, SaaS","Munich, Bayern, Germany",European Union (EU),2018-09-01,day,,,2018-05-01,150000,EUR,179867,Pre-Seed,150000,EUR,179867,Seed,,
IDnow,https://www.crunchbase.com/organization/idnow,"Identity Management, Information Technology, Internet","München, Bayern, Germany",European Union (EU),2014-01-01,year,,,2018-05-17,,,,Series B,,,,Early Stage Venture,"10x Group, BayBG, Seventure Partners, YoungBrains",4
Scroll,https://www.crunchbase.com/organization/scroll-network,"Blockchain, Enterprise Software, Peer to Peer, SaaS, Software","New Haven, Connecticut, United States","East Coast, New England, Northeastern US",2017-11-01,day,,,2018-05-12,1000000,USD,1000000,Seed,1000000,USD,1000000,Seed,,
HiveTracker,https://www.crunchbase.com/organization/hivetracker,"Identity Management, Logistics, Supply Chain Management","Nyon, Vaud, Switzerland",,2018-01-01,month,,,2018-04-03,500000,EUR,613948,Seed,500000,EUR,613948,Seed,"Plug and Play, Startup Braga",2
Expand,https://www.crunchbase.com/organization/gems-f45e,"Blockchain, Crowdsourcing, Cryptocurrency","San Francisco, California, United States","San Francisco Bay Area, West Coast, Western US",,,,,2018-01-29,1000000,USD,1000000,Initial Coin Offering,1000000,USD,1000000,,Node Capital,1
22X Fund,https://www.crunchbase.com/organization/22x-fund,"Banking, Blockchain, Crowdfunding","Cupertino, California, United States","San Francisco Bay Area, Silicon Valley, West Coast",2018-01-01,month,,,2018-02-01,180000,USD,180000,Pre-Seed,180000,USD,180000,Seed,ARK FUND,1
iXDen,https://www.crunchbase.com/organization/ix-den,"Cyber Security, Internet of Things","Jerusalem, Yerushalayim, Israel",,2017-01-01,year,,,2018-01-15,,,,Convertible Note,100000,USD,100000,Seed,"F2 Capital, The Junction",2
Shano Ltd,https://www.crunchbase.com/organization/shano-ltd,"Blockchain, Facilities Support Services, Real Estate","New York, New York, United States","Greater New York Area, East Coast, Northeastern US",2015-01-01,year,,,2018-02-06,8000000,USD,8000000,Seed,8000000,USD,8000000,Seed,"DHVC, Tom Arrix",2
ArtChain Global,https://www.crunchbase.com/organization/artchain-global,"Art, Blockchain, Information Technology, Security, Software","Melbourne, Victoria, Australia","Asia-Pacific (APAC), Australasia",2017-01-01,year,,,2018-05-01,4000000,USD,4000000,Seed,4000000,USD,4000000,Seed,,
Detectify,https://www.crunchbase.com/organization/detectify,"Cloud Infrastructure, Security, Web Apps","Stockholm, Stockholms Lan, Sweden","European Union (EU), Nordic Countries, Scandinavia",2012-01-01,year,,,2018-03-16,5000000,EUR,6148133,Series A,5000000,EUR,6148133,Early Stage Venture,"First Fellow Partners, Hannu Turunen, Insight Partners, Inventure, Paua Ventures",9
Giroxx,https://www.crunchbase.com/organization/giroxx,"Banking, Financial Services, Security","Frankfurt, Hessen, Germany",European Union (EU),2015-01-01,year,,,2018-03-14,900000,EUR,1113735,Seed,900000,EUR,1113735,Seed,Hessen Kapital I GmbH,1
IDOS CORP,https://www.crunchbase.com/organization/idos-corp,"Accounting, Compliance, FinTech, Information Technology, Software","Arlington, Virginia, United States","Washington DC Metro Area, East Coast, Southern US",2014-06-01,month,,,2018-03-01,500000,USD,500000,Seed,500000,USD,500000,Seed,"Microsoft Accelerator Bangalore, Sharath Chandra, Start-Up Chile",3
Gifto,https://www.crunchbase.com/organization/gifto,"Blockchain, Ethereum, Virtual Reality","Beijing, Beijing, China",Asia-Pacific (APAC),,,,,2018-01-04,,,,Venture - Series Unknown,,,,,"8 Decimal Capital, BlockVC, Node Capital",3
VSORA,https://www.crunchbase.com/organization/vsora,"Communications Infrastructure, Network Security, Semiconductor","Vélizy-villacoublay, Ile-de-France, France",European Union (EU),2015-01-01,year,,,2018-01-17,1700000,USD,1700000,Series A,1700000,USD,1700000,Early Stage Venture,"Omnes Capital, Partech",2
Inlock,https://www.crunchbase.com/organization/inlock,"Blockchain, Commercial Lending, Consumer Lending, Credit, Finance, Financial Services, FinTech","Budapest, Budapest, Hungary",European Union (EU),2018-01-03,day,,,2018-06-05,1812000,USD,1812000,Initial Coin Offering,1812000,USD,1812000,,,
AIVIA,https://www.crunchbase.com/organization/nousplatform,"Blockchain, Computer, Financial Services, Information Technology, Software","San Diego, California, United States","Greater San Diego Area, West Coast, Western US",2017-04-25,day,,,2018-01-31,480000,USD,480000,Seed,480000,USD,480000,Seed,,
Templum,https://www.crunchbase.com/organization/templum,"Asset Management, Blockchain, Consulting, Financial Exchanges, Financial Services, FinTech, Information Technology","New York, New York, United States","Greater New York Area, East Coast, Northeastern US",2017-09-01,month,,,2018-04-24,10000000,USD,10000000,Venture - Series Unknown,10000000,USD,10000000,,"Blockchain Capital, CMT Digital Ventures LLC, Firstminute Capital, Raptor Group, SBI Group",6
ICO Watchdog,https://www.crunchbase.com/organization/ico-watchdog,"Blockchain, Cryptocurrency, Finance, Financial Services, FinTech, News","Santa Monica, California, United States","Greater Los Angeles Area, West Coast, Western US",2017-09-20,day,,,2018-03-20,500000,USD,500000,Seed,500000,USD,500000,Seed,Science,1
Skraps,https://www.crunchbase.com/organization/skraps,"Cryptocurrency, Finance","Los Angeles, California, United States","Greater Los Angeles Area, West Coast, Western US",2017-01-01,year,,,2018-01-14,3000000,USD,3000000,Initial Coin Offering,3000000,USD,3000000,,,
Hunter2,https://www.crunchbase.com/organization/hunter2,"Computer, Security, Software, Web Apps","San Francisco, California, United States","San Francisco Bay Area, West Coast, Western US",,,,,2018-01-04,120000,USD,120000,Seed,120000,USD,120000,Seed,Y Combinator,1
"GTop Group, Corp.",https://www.crunchbase.com/organization/gtop-group-corp,"Artificial Intelligence, Asset Management, Homeland Security, Law Enforcement, Market Research, National Security, Predictive Analytics, Public Safety, Risk Management, Security","New York, New York, United States","Greater New York Area, East Coast, Northeastern US",2016-12-06,day,,,2018-06-08,500000,USD,500000,Seed,500000,USD,500000,Seed,,
OpenSea,https://www.crunchbase.com/organization/opensea,"Blockchain, Cryptocurrency, Marketplace","San Francisco, California, United States","San Francisco Bay Area, West Coast, Western US",2017-12-20,day,,,2018-05-10,2000000,USD,2000000,Seed,2000000,USD,2000000,Seed,"Blockchain Capital, Blockstack, Foundation Capital, Founders Fund, Y Combinator",11
