NGN,https://www.crunchbase.com/organization/ngn,"Blockchain, Cryptocurrency, Trading Platform","Baar, Zug, Switzerland",,2018-01-01,month,,,2018-02-01,50000,USD,50000,Seed,50000,USD,50000,Seed,,
EMX,https://www.crunchbase.com/organization/evermarkets,"Blockchain, Computer, Software","San Francisco, California, United States","San Francisco Bay Area, West Coast, Western US",,,,,2018-01-10,,,,Seed,,,,Seed,"Chain Capital, Hashed",2
Chexianglian,https://www.crunchbase.com/organization/chexianglian,Blockchain,"Shenzhen, Guangdong, China",Asia-Pacific (APAC),2017-01-01,year,,,2018-06-22,20000000,USD,20000000,Angel,20000000,USD,20000000,Seed,Grand Shores Ventures,1
CtrlShift.co,https://www.crunchbase.com/organization/ctrlshift-co,"Blockchain, Information Technology, News","New York, New York, United States","Greater New York Area, East Coast, Northeastern US",2017-01-01,year,,,2018-04-13,130000,USD,130000,Seed,130000,USD,130000,Seed,Starta Accelerator,1
Paymon,https://www.crunchbase.com/organization/paymon,"Blockchain, Internet, Payments","Yekaterinburg, Sverdlovsk, Russian Federation",,2016-01-01,year,,,2018-04-04,500000,USD,500000,Initial Coin Offering,500000,USD,500000,,,
AB-Chain,https://www.crunchbase.com/organization/ab-chain,"Blockchain, Cryptocurrency","Hong Kong, Hong Kong Island, Hong Kong",Asia-Pacific (APAC),2017-01-01,year,,,2018-03-22,1850000,USD,1850000,Initial Coin Offering,1850000,USD,1850000,,,
Anbai Technology,https://www.crunchbase.com/organization/anbai-technology,"Cloud Computing, Computer, Cyber Security, Internet","Beijing, Beijing, China",Asia-Pacific (APAC),,,,,2018-03-13,9500000,USD,9500000,Series A,9500000,USD,9500000,Early Stage Venture,Binhai,1
LIC,https://www.crunchbase.com/organization/lic,"Blockchain, Information Technology, Software","Singapore, Central Region, Singapore","Asia-Pacific (APAC), Association of Southeast Asian Nations (ASEAN), Southeast Asia",2018-04-01,month,,,2018-06-01,300000,USD,300000,Pre-Seed,300000,USD,300000,Seed,,
Bizhihui.vip,https://www.crunchbase.com/organization/bizhihui-vip,Blockchain,"Guangzhou, Guangdong, China",Asia-Pacific (APAC),2016-01-01,year,,,2018-06-21,1544200,USD,1544200,Seed,1544200,USD,1544200,Seed,"OK Blockchain Capital, Shubei Investment",2
Coinmeet,https://www.crunchbase.com/organization/coinmeet,"Blockchain, Digital Media",,,,,,,2018-01-13,1000000,USD,1000000,Seed,1000000,USD,1000000,Seed,"BlockVC, Node Capital",2
BlockchainCybertech Limited,https://www.crunchbase.com/organization/blockchaincybertech-limited,"Artificial Intelligence, Blockchain, Finance, FinTech, Supply Chain Management","Nairobi, Nairobi Area, Kenya",,2018-03-08,day,,,2018-03-08,200000,USD,200000,Seed,200000,USD,200000,Seed,Shariff Abdulwalli,1
Keyrock,https://www.crunchbase.com/organization/keyrock,"Asset Management, Blockchain, Cryptocurrency, Finance, Financial Services","Woluwé-saint-pierre, Brussels Hoofdstedelijk Gewest, Belgium",European Union (EU),2017-01-01,year,,,2018-04-26,900000,EUR,1089755,Seed,900000,EUR,1089755,Seed,"Seeder Fund, TNN Capital, Volta Ventures",3
Peoplecard.co,https://www.crunchbase.com/organization/peoplecard-co,"Blockchain, Debit Cards","Manta, Manabi, Ecuador",,2017-08-06,day,2017-08-21,day,2018-02-06,150000,USD,150000,Seed,150000,USD,150000,M&A,Proasercop S.a,1
PreVeil,https://www.crunchbase.com/organization/preveil,"Cyber Security, Information Technology, Software","Boston, Massachusetts, United States","Greater Boston Area, East Coast, New England",2015-01-01,year,,,2018-03-27,,,,Series A,,,,Early Stage Venture,Spark Capital,1
Parachute8 Inc.,https://www.crunchbase.com/organization/parachute8-inc,"Blockchain, Identity Management, Information Technology, Privacy, Security","Salida, Colorado, United States",Western US,2017-11-09,day,,,2018-03-31,50000,USD,50000,Seed,50000,USD,50000,Seed,unknown  ,1
Block360.Pro,https://www.crunchbase.com/organization/block360-pro,"Blockchain, Social Media","Beijing, Beijing, China",Asia-Pacific (APAC),2017-01-01,year,,,2018-04-20,4421000,USD,4421000,Series A,4421000,USD,4421000,Early Stage Venture,"Achain, BeeChat Fund, Goopal Group, Hash Capital, Vancoin Capital",5
Everproof,https://www.crunchbase.com/organization/everproof,"Identity Management, SaaS","Collingwood, Victoria, Australia","Asia-Pacific (APAC), Australasia",2015-01-01,year,,,2018-02-20,1500000,AUD,1182102,Seed,1500000,AUD,1182102,Seed,"Allectus Capital, Reinventure Group",2
Bochuangliandong,https://www.crunchbase.com/organization/bochuangliandong,"Commercial, Data Center, Network Security","Beijing, Beijing, China",Asia-Pacific (APAC),,,,,2018-04-09,15800000,USD,15800000,Series B,15800000,USD,15800000,Early Stage Venture,"Baidu Ventures, Kexin Capital, The Hina Group, Walden International, Yinxinggu Capital",5
Block Star,https://www.crunchbase.com/organization/block-star,Blockchain,"Xiamen, Fujian, China",Asia-Pacific (APAC),2017-01-01,year,,,2018-06-25,1531000,USD,1531000,Angel,1531000,USD,1531000,Seed,,
Efir.io,https://www.crunchbase.com/organization/efir-io,"Advertising Platforms, Blockchain, Blogging Platforms, Marketplace","Moscow, Moscow City, Russian Federation",,2017-01-01,day,,,2018-05-14,,,,Initial Coin Offering,,,,,Broad Harvest Holdings Limited,1
TACChain,https://www.crunchbase.com/organization/tacchain,Blockchain,"Beijing, Beijing, China",Asia-Pacific (APAC),2015-12-01,month,,,2018-05-24,700000,USD,700000,Series A,700000,USD,700000,Early Stage Venture,"Chainfo Capital, H. Capital, Happy East Capital, Hyper Fund, Node Capital",9
Scanovate,https://www.crunchbase.com/organization/scanovate,"B2B, B2C, Biometrics, Financial Services, Hardware, Identity Management, Mobile Devices, Printing, Software","Ramat Gan, Tel Aviv, Israel",,2015-01-15,day,,,2018-04-16,,,,Series A,,,,Early Stage Venture,Global Fintech Solutions,1
EOS,https://www.crunchbase.com/organization/eos-io,"Blockchain, Cryptocurrency, Infrastructure, Software","Seoul, Seoul-t'ukpyolsi, South Korea",Asia-Pacific (APAC),,,,,2018-03-22,100000000,USD,100000000,Private Equity,100000000,USD,100000000,Private Equity,"8 Decimal Capital, Block.one, Connect Capital, Hashed, Henry Rouquairol",5
OMNY,https://www.crunchbase.com/organization/omny,"Blockchain, Health Care, Hospital, Pharmaceutical","San Francisco, California, United States","San Francisco Bay Area, West Coast, Western US",2017-01-01,year,,,2018-02-01,,,,Venture - Series Unknown,,,,,"DNA Capital, Kevin Ryan, Merus Capital, Social Capital, StartX (Stanford-StartX Fund)",11
Thebhub,https://www.crunchbase.com/organization/thebhub,"Artificial Intelligence, Blockchain, Innovation Management, Social Impact","Nairobi, Nairobi Area, Kenya",,2018-01-01,day,,,2018-03-08,100000,USD,100000,Seed,100000,USD,100000,Seed,Shariff Abdulwalli,1
Slife,https://www.crunchbase.com/organization/slife,Blockchain,"Hangzhou, Zhejiang, China",Asia-Pacific (APAC),2018-01-01,year,,,2018-06-21,15000000,USD,15000000,Angel,15000000,USD,15000000,Seed,"Canaan Partners, Collinstar Capital, Funcity Capital, Timestamp Capital, Wanxiang Blockchain",5
Hoo Technology,https://www.crunchbase.com/organization/hoo-technology,"Bitcoin, Blockchain, Cryptocurrency","Hong Kong, Hong Kong Island, Hong Kong",Asia-Pacific (APAC),2017-01-01,year,,,2018-06-28,4529000,USD,4529000,Angel,4529000,USD,4529000,Seed,Wang Ruixi,1
Pei,https://www.crunchbase.com/organization/pei-technology-inc,"Cryptocurrency, FinTech, Loyalty Programs, Security","Los Angeles, California, United States","Greater Los Angeles Area, West Coast, Western US",2017-01-01,year,,,2018-04-04,,,,Seed,,,,Seed,Sputnik ATX,1
Walnut Exchange,https://www.crunchbase.com/organization/walnut-exchange,"Blockchain, Financial Services, FinTech","Wellington, Wellington, New Zealand","Asia-Pacific (APAC), Australasia",2017-01-01,year,,,2018-02-01,100000,AUD,80399,Seed,100000,AUD,80399,Seed,H2 Ventures,1
Oneiro,https://www.crunchbase.com/organization/oneiro,"Blockchain, Computer, Cryptocurrency, Professional Networking","Boston, Massachusetts, United States","Greater Boston Area, East Coast, New England",2017-01-01,year,,,2018-02-19,3000000,USD,3000000,Seed,3000000,USD,3000000,Seed,COSIMO Ventures,1
Joys,https://www.crunchbase.com/organization/joys,"Cryptocurrency, Payments, Retail","Grand Cayman, Midland, Cayman Islands",,2017-08-01,day,,,2018-06-21,421000,USD,421000,Initial Coin Offering,421000,USD,421000,,,
ChainHoo,https://www.crunchbase.com/organization/chainhoo,"Blockchain, Information Technology, News","Shenzhen, Guangdong, China",Asia-Pacific (APAC),,,,,2018-04-18,3200000,USD,3200000,Seed,3200000,USD,3200000,Seed,,
BlockIDE,https://www.crunchbase.com/organization/blockide,"Blockchain, Financial Services, Internet, Software","Lakeland, Florida, United States","East Coast, Southern US",2017-11-01,month,,,2018-02-03,25000,USD,25000,Seed,25000,USD,25000,Seed,Tigerlabs,1
Smile Identity,https://www.crunchbase.com/organization/smile-identity,"Apps, Identity Management, Machine Learning","Oakland, California, United States","San Francisco Bay Area, West Coast, Western US",2017-01-01,year,,,2018-04-09,,,,Seed,,,,Seed,"500 Startups, Catalyst Fund, Savannah Fund, Susa Ventures, ValueStream Ventures",8
Applied Blockchain,https://www.crunchbase.com/organization/applied-blockchain,"Blockchain, Computer, Finance, Payments, Software","London, England, United Kingdom",European Union (EU),2016-11-01,month,,,2018-01-18,,,,Venture - Series Unknown,,,,,"Calibrate Management, Momentum London, Shell Trading International",3
Gyomo,https://www.crunchbase.com/organization/gyomo,"CleanTech, Energy, Energy Management, Security","Herndon, Virginia, United States","Washington DC Metro Area, East Coast, Southern US",,,,,2018-04-24,16100,USD,16100,Equity Crowdfunding,16100,USD,16100,,"StartEngine, Startupbootcamp FinTech & CyberSecurity",2
Kosmonotes,https://www.crunchbase.com/organization/kosmonotes,"Artificial Intelligence, Cryptocurrency, Education, Information Technology","Melbourne, Victoria, Australia","Asia-Pacific (APAC), Australasia",2017-01-01,year,,,2018-02-01,100000,AUD,80399,Seed,100000,AUD,80399,Seed,H2 Ventures,1
Strix Leviathan,https://www.crunchbase.com/organization/strix-leviathan,"Blockchain, Computer, Cryptocurrency, Finance, Software","Seattle, Washington, United States","Greater Seattle Area, West Coast, Western US",2018-01-01,month,,,2018-03-15,1625000,USD,1625000,Seed,1625000,USD,1625000,Seed,"9Mile Labs, Curious Capital, Founders' Co-op, Future Perfect Ventures, Liquid 2 Ventures",8
Hashdex,https://www.crunchbase.com/organization/hashdex,"Asset Management, Blockchain, Cryptocurrency, Financial Services, FinTech, Information Technology, Software","George Town, Midland, Cayman Islands",,2018-02-01,day,,,2018-04-24,,,,Seed,,,,Seed,"Canary, Graph Ventures, Mauricio Feldman, Outlier Ventures, Social Capital",5
GuestOf,https://www.crunchbase.com/organization/guestof,"Hardware, Identity Management, Internet of Things, PaaS, Real Estate, SaaS, Security, Software","Philadelphia, Pennsylvania, United States","Greater Philadelphia Area, Great Lakes, Northeastern US",2016-02-15,day,,,2018-03-31,,,,Non-equity Assistance,,,,,"Ben Franklin Technology Partners of Southeastern Pennsylvania, ic@3401, NextFab",3
UBICUO,https://www.crunchbase.com/organization/ubicuo,"Apps, Mapping Services, Security","Córdoba, Cordoba, Argentina",,2015-07-02,day,,,2018-05-04,40000,USD,40000,Seed,40000,USD,40000,Seed,Start-Up Chile,1
Decred,https://www.crunchbase.com/organization/decred,"Bitcoin, Cryptocurrency, FinTech","Chicago, Illinois, United States","Greater Chicago Area, Great Lakes, Midwestern US",2016-02-08,day,,,2018-06-14,,,,Venture - Series Unknown,,,,,BlueYard Capital,1
Olarm Alarm Service,https://www.crunchbase.com/organization/olarm-alarm-service,"Public Safety, Security",,,,,,,2018-06-25,99819,USD,99819,Product Crowdfunding,,,,,,
"Gryphon Online Safety, Inc.",https://www.crunchbase.com/organization/gryphon-online-safety-inc,"Consumer Electronics, Cyber Security, Internet of Things, Machine Learning, Network Security, Wireless","San Diego, California, United States","Greater San Diego Area, West Coast, Western US",2014-08-14,day,,,2018-03-23,,,,Seed,,,,Seed,SeedInvest,1
BLOCKStrain Technology Corp.,https://www.crunchbase.com/organization/blockstrain-technology,"Blockchain, Cannabis, Genetics, Information Technology, Intellectual Property, Quality Assurance, Real Estate, Software","Vancouver, British Columbia, Canada",,,,,,2018-03-19,,,,Corporate Round,,,,,"Internet of Things Inc., WeedMD",2
WePower Network,https://www.crunchbase.com/organization/wepower-network,"Blockchain, Environmental Consulting, Financial Services, Information Technology, Trading Platform","Vilnius, Vilniaus Apskritis, Lithuania",European Union (EU),2017-01-01,year,,,2018-02-02,,,,Initial Coin Offering,,,,,"Distributed Network Advisors, Everblu Capital, LDJ Capital, Prime Block Capital, Science",12
AzaadHealth,https://www.crunchbase.com/organization/azaadhealth,"Big Data, Blockchain, Health Care, Health Insurance, Medical, Personal Health, Wellness","Karachi, Sindh, Pakistan",Asia-Pacific (APAC),2016-08-01,day,,,2018-03-30,,,,Seed,,,,Seed,StartUp Health,1
Fortmatic,https://www.crunchbase.com/organization/fortmatic-inc,"Apps, Blockchain, Developer Tools, Ethereum, Information Technology, Mobile Apps","San Francisco, California, United States","San Francisco Bay Area, West Coast, Western US",,,,,2018-01-08,,,,Seed,,,,Seed,"Jeffrey Tong, Kevin Moore, SV Angel",3
Vest,https://www.crunchbase.com/organization/one-protocol-inc-1protocol,"Blockchain, Risk Management","San Francisco, California, United States","San Francisco Bay Area, West Coast, Western US",2017-02-10,day,,,2018-03-08,,,,Seed,,,,Seed,1confirmation,1
OPTIMOZ,https://www.crunchbase.com/organization/optimoz,"Cloud Computing, Cloud Infrastructure, Cloud Management, Cloud Security","Bethesda, Maryland, United States","Washington DC Metro Area, East Coast, Southern US",,,,,2018-05-22,2000000,USD,2000000,Series A,2000000,USD,2000000,Early Stage Venture,Global Environment Fund Management,1
Gonbike,https://www.crunchbase.com/organization/gonbike,"Mobile Apps, Ride Sharing, Security","Shanghai, Shanghai, China",Asia-Pacific (APAC),,,,,2018-01-05,15000000,USD,15000000,Angel,15000000,USD,15000000,Seed,Quan Capital,1
Ontology,https://www.crunchbase.com/organization/ontology,"Blockchain, FinTech, Infrastructure, Internet","Shanghai, Shanghai, China",Asia-Pacific (APAC),,,,,2018-04-13,,,,Venture - Series Unknown,,,,,"8 Decimal Capital, BlockVC, DHVC, Hashed, JLAB | JD capital",5
CounterFlow,https://www.crunchbase.com/organization/counterflow,"Artificial Intelligence, Computer, Network Security","Crozet, Virginia, United States","East Coast, Southern US",2017-01-01,year,,,2018-02-18,2700000,USD,2700000,Seed,2700000,USD,2700000,Seed,"Charlottesville Angel Network, OUP (Osage University Partners)",2
Denim Group,https://www.crunchbase.com/organization/denim-group,"Information Technology, Network Security, Security","San Antonio, Texas, United States",Southern US,2001-01-01,year,,,2018-03-01,,,,Corporate Round,,,,,Wipro Technologies,1
Byzia Corporation,https://www.crunchbase.com/organization/byzia-corporation,"Cyber Security, Information Technology, Internet, Telecommunications, Web Hosting","London, England, United Kingdom",European Union (EU),2018-01-01,year,,,2018-01-17,15000,EUR,18270,Seed,15000,EUR,18270,Seed,,
Timberchain,https://www.crunchbase.com/organization/timberchain,"Blockchain, Cryptocurrency, Information Technology, Internet, Online Portals, Trading Platform","Santiago, Region Metropolitana, Chile",,,,,,2018-05-04,40000,USD,40000,Seed,40000,USD,40000,Seed,Start-Up Chile,1
315Net,https://www.crunchbase.com/organization/315net,"Cyber Security, Information Technology, Marketing","Hainan, Hainan, China",Asia-Pacific (APAC),,,,,2018-03-14,31600000,USD,31600000,Series A,31600000,USD,31600000,Early Stage Venture,Mount Morning Capital,1
DRsafe,https://www.crunchbase.com/organization/drsafe,"Bitcoin, Blockchain, Cryptocurrency","Shanghai, Shanghai, China",Asia-Pacific (APAC),2018-01-01,year,,,2018-06-28,1509500,USD,1509500,Angel,1509500,USD,1509500,Seed,"JRR Crypto, Shunwei Capital",2
Bitshopp,https://www.crunchbase.com/organization/bitshopp,"Cryptocurrency, FinTech, Marketplace","São Paulo, Sao Paulo, Brazil",,2017-01-07,day,,,2018-03-01,30000,USD,30000,Seed,30000,USD,30000,Seed,,
Deep Science,https://www.crunchbase.com/organization/deep-science-ai,"Artificial Intelligence, Insurance, Machine Learning, Security, Video","San Francisco, California, United States","San Francisco Bay Area, West Coast, Western US",2016-05-15,day,2019-03-01,day,2018-03-12,,,,Seed,,,,M&A,"Alchemist Accelerator, James Sowers",2
Arise Travel,https://www.crunchbase.com/organization/arise-technology,"Blockchain, Hotel, Travel","San Francisco, California, United States","San Francisco Bay Area, West Coast, Western US",2017-12-01,month,,,2018-04-01,,,,Seed,,,,Seed,"The Refiners, Unshackled Ventures, Varsha Rao",3
Zhuafan,https://www.crunchbase.com/organization/zhuafan,"Apps, Blockchain, Internet, Video","Beijing, Beijing, China",Asia-Pacific (APAC),,,,,2018-05-29,5000000,USD,5000000,Angel,5000000,USD,5000000,Seed,Xinpai Capital,1
Heedful,https://www.crunchbase.com/organization/heedful,"Apps, Automotive, Security, Social Network","London, England, United Kingdom",European Union (EU),2018-01-01,month,,,2018-01-18,20000,GBP,27785,Pre-Seed,20000,GBP,27785,Seed,,
AdaptiveMobile,https://www.crunchbase.com/organization/adaptivemobile,"Enterprise, Mobile, Security, Telecommunications","Dublin, Dublin, Ireland",European Union (EU),2003-01-01,year,,,2018-04-10,,,,Debt Financing,14000000,USD,14000000,Early Stage Venture,"Doughty Hanson & Co, Enterprise Ireland, Harbert European Growth Capital, Intel Capital, Noor Financial Investment",5
Keep,https://www.crunchbase.com/organization/keep,"Finance, Security","George Town, Midland, Cayman Islands",,,,,,2018-04-01,,,,Undisclosed,,,,,"Andreessen Horowitz, Compound, Dekrypt Capital, Fabric Ventures, Polychain",7
Secberus,https://www.crunchbase.com/organization/secberus,"Cyber Security, Information Technology, Security","Miami, Florida, United States","Greater Miami Area, East Coast, Southern US",2017-12-01,month,,,2018-04-17,,,,Seed,,,,Seed,CyLon,1
VSFT HOLDINGS,https://www.crunchbase.com/organization/vsft-holdings,"Security, Software","Lewes, Delaware, United States","East Coast, Southern US",2016-01-01,year,,,2018-04-13,340000,USD,340000,Seed,340000,USD,340000,Seed,,
MenaPay,https://www.crunchbase.com/organization/menapay,"Blockchain, FinTech, Payments","Dubai, Dubai, United Arab Emirates",Gulf Cooperation Council (GCC),2017-11-01,month,,,2018-06-02,,,,Seed,,,,Seed,Boğaziçi Ventures,1
QUID,https://www.crunchbase.com/organization/quid-works,"Blockchain, Cloud Computing, Finance, FinTech, Payments","Toronto, Ontario, Canada",Great Lakes,2017-08-22,day,,,2018-05-01,,,,Pre-Seed,,,,Seed,Mistral Venture Partners,1
Silverfriend,https://www.crunchbase.com/organization/silverfriend,Cyber Security,"Maidenhead, Windsor and Maidenhead, United Kingdom",European Union (EU),2017-06-26,day,,,2018-01-05,177320,GBP,240569,Equity Crowdfunding,177320,GBP,240569,,Crowdcube,1
Rippe & Kingston,https://www.crunchbase.com/organization/rippe-kingston,"Accounting, Compliance, Software, Training","Cincinnati, Ohio, United States","Great Lakes, Midwestern US",1980-01-01,year,,,2018-05-02,,,,Private Equity,,,,Private Equity,ParkerGale Capital,1
Ubisecure,https://www.crunchbase.com/organization/ubisecure,"Cloud Security, Cyber Security, Enterprise Software, Identity Management, Privacy","Espoo, Southern Finland, Finland","European Union (EU), Nordic Countries, Scandinavia",2002-01-01,year,,,2018-05-17,,,,Series A,,,,Early Stage Venture,"Base 10 Ventures, Octopus Investments",2
Signatrix,https://www.crunchbase.com/organization/signatrix,"Artificial Intelligence, Computer Vision, Industrial Automation, Machine Learning, Retail Technology, Security","Berlin, Berlin, Germany",European Union (EU),2017-06-01,month,,,2018-04-01,,,,Pre-Seed,,,,Seed,"Alfred Bauer, EXIST",2
INARI,https://www.crunchbase.com/organization/inari,"Artificial Intelligence, Blockchain, Information Services, Information Technology","Barcelona, Catalonia, Spain",European Union (EU),2017-05-01,month,,,2018-05-25,,,,Seed,,,,Seed,,
Block Collider,https://www.crunchbase.com/organization/block-collider,"Blockchain, Computer, Finance","Chicago, Illinois, United States","Greater Chicago Area, Great Lakes, Midwestern US",,,,,2018-05-10,,,,Initial Coin Offering,,,,,"8 Decimal Capital, Connect Capital, Enabling Future",3
Patronus.io,https://www.crunchbase.com/organization/patronus-io,"Cyber Security, Information Technology, Security, Software","Berlin, Berlin, Germany",European Union (EU),2015-01-01,year,,,2018-05-09,,,,Venture - Series Unknown,,,,,"Innogy Innovation Hub, Mountain Partners, Rheingau Founders",3
Strattic,https://www.crunchbase.com/organization/strattic,"Cloud Infrastructure, CMS, Cyber Security, Information Technology, Open Source, SaaS, Web Hosting","Jerusalem, Yerushalayim, Israel",,2018-01-30,day,,,2018-01-30,,,,Pre-Seed,,,,Seed,,
Cell Evolution,https://www.crunchbase.com/organization/cell-evolution,"Apps, Bitcoin, Blockchain","Nanjing, Jiangsu, China",Asia-Pacific (APAC),2018-01-01,year,,,2018-06-22,750000,USD,750000,Seed,750000,USD,750000,Seed,"Byte Ventures, Cocos Blockchain Expedition, Nebulas.io",3
Blockchain4Africa,https://www.crunchbase.com/organization/blockchain4africa-06c0,"Blockchain, FinTech","Lagos, Lagos, Nigeria",,2018-06-28,day,,,2018-06-28,3000,USD,3000,Seed,3000,USD,3000,Seed,,
EnvKey,https://www.crunchbase.com/organization/envkey,"Cyber Security, Developer APIs, Software","Montclair, New Jersey, United States","Greater New York Area, East Coast, Northeastern US",2017-03-01,month,,,2018-01-04,,,,Seed,,,,Seed,"FundersClub, Y Combinator",2
Aclaro Inc.,https://www.crunchbase.com/organization/aclaro-inc,"Analytics, Big Data, Blockchain, FinTech, Information Technology, Marketing","Miami, Florida, United States","Greater Miami Area, East Coast, Southern US",2018-01-31,day,,,2018-06-15,,,,Seed,,,,Seed,,
Kuanghaihui,https://www.crunchbase.com/organization/kuanghaihui,Blockchain,,,2018-01-01,year,,,2018-06-25,1531000,USD,1531000,Seed,1531000,USD,1531000,Seed,"Geekbeans Capital, Prime Mont V.C",2
Atomic Fund,https://www.crunchbase.com/organization/atomic-fund,"Cryptocurrency, Financial Services, FinTech","San Francisco, California, United States","San Francisco Bay Area, West Coast, Western US",2017-01-01,year,,,2018-01-15,,,,Seed,,,,Seed,Boost VC,1
Heex Technologies,https://www.crunchbase.com/organization/heex-technologies,"Artificial Intelligence, Autonomous Vehicles, Blockchain, Machine Learning, Robotics, Software, Transportation","Paris, Ile-de-France, France",European Union (EU),2017-01-01,year,,,2018-05-01,,,,Seed,,,,Seed,Deimos Capital,1
Metaco,https://www.crunchbase.com/organization/metaco,"Banking, Bitcoin, Blockchain, Cryptocurrency, Ethereum, Information Technology","Lausanne, Vaud, Switzerland",,2014-01-01,year,,,2018-04-27,,,,Venture - Series Unknown,,,,,"Avaloq, SICPA, Swiss Post, Swisscom",4
Crashtest Security GmbH,https://www.crunchbase.com/organization/crashtest-security-gmbh,"Artificial Intelligence, Computer, Information Technology, Network Security","Munich, Bayern, Germany",European Union (EU),2017-01-01,year,,,2018-04-10,,,,Seed,,,,Seed,"BayStartUP, Gian Reto à Porta, Nicolas Cepeda, Pascal Tilgner, Thomas Dübendorfer",5
Holdvest,https://www.crunchbase.com/organization/holdvest,"Blockchain, Internet, Software","Moscow, Moscow City, Russian Federation",,,,,,2018-05-13,211025,USD,211025,Initial Coin Offering,211025,USD,211025,,,
BlockWorks Group,https://www.crunchbase.com/organization/blockworks-group,"Banking, Cryptocurrency, Events, Media and Entertainment, Payments, Podcast","Brooklyn, New York, United States","Greater New York Area, East Coast, Northeastern US",2017-01-01,year,,,2018-05-01,,,,Seed,,,,Seed,,
wevest Digital AG,https://www.crunchbase.com/organization/wevest-digital-ag,"Blockchain, Financial Services, FinTech, Personal Finance","Berlin, Berlin, Germany",European Union (EU),2018-01-01,year,,,2018-06-01,,,,Seed,,,,Seed,Comvest Holding,1
"Blockfreight, Inc.",https://www.crunchbase.com/organization/blockfreight-inc,"Bitcoin, Enterprise Software, Logistics, Software","San Francisco, California, United States","San Francisco Bay Area, West Coast, Western US",2017-03-03,day,,,2018-01-25,,,,Seed,,,,Seed,,
DADA,https://www.crunchbase.com/organization/dada-nyc,"Art, Content Creators, Cryptocurrency, Digital Media","Brooklyn, New York, United States","Greater New York Area, East Coast, Northeastern US",2012-04-04,day,,,2018-05-14,,,,Seed,,,,Seed,ConsenSys Ventures,1
Open Platform,https://www.crunchbase.com/organization/open-platform,"Blockchain, Cryptocurrency, Infrastructure, Payments","San Francisco, California, United States","San Francisco Bay Area, West Coast, Western US",,,,,2018-03-28,,,,Initial Coin Offering,,,,,"DHVC, Draper Dragon, NEO Global Capital (NGC), Reflective Venture Partners, Sora Ventures",6
Advanced Virtual,https://www.crunchbase.com/organization/advanced-virtual,"Artificial Intelligence, Augmented Reality, Big Data, Blockchain, FinTech, IaaS, Intelligent Systems, Internet of Things, Machine Learning, Natural Language Processing, Operating Systems, PaaS, Predictive Analytics, Robotics, SaaS, Virtual Reality","Cork, Cork, Ireland",European Union (EU),2008-01-01,year,,,2018-05-23,,,,Series A,,,,Early Stage Venture,,
MicroSec,https://www.crunchbase.com/organization/microsec,"Information Technology, Messaging, Security","Singapore, Central Region, Singapore","Asia-Pacific (APAC), Association of Southeast Asian Nations (ASEAN), Southeast Asia",2016-01-01,year,,,2018-01-31,,,,Seed,,,,Seed,"Rekanext, SGInnovate, SparkLabs Global Ventures, Wavemaker Partners",4
