BIRD Aerosystems,https://www.crunchbase.com/organization/bird-aerosystems,"Aerospace, Security","Herzliya, Tel Aviv, Israel",,2001-01-01,year,,,2018-07-11,40000000,USD,40000000,Private Equity,40000000,USD,40000000,Private Equity,First Israel Mezzanine Investors Ltd,1
Yunshan Networks,https://www.crunchbase.com/organization/yunshan-networks,"Data Center Automation, Network Security, Software","Beijing, Beijing, China",Asia-Pacific (APAC),2011-12-01,month,,,2018-09-27,11000000,USD,11000000,Series B,11000000,USD,11000000,Early Stage Venture,"China Growth Capital | CGC, Lenovo Capital and Incubator Group (LCIG), Matrix Partners China, Northern Light Venture Capital, Redpoint Ventures China",5
Valid Network,https://www.crunchbase.com/organization/valid-network,"Blockchain, Information Technology","Haifa, Hefa, Israel",,2017-01-01,year,,,2018-10-16,2000000,USD,2000000,Seed,2000000,USD,2000000,Seed,"Jerusalem Venture Partners (JVP), JVP Cyber Labs",2
The Blockchainer,https://www.crunchbase.com/organization/the-blockchainer,"Blockchain, FinTech","Shanghai, Shanghai, China",Asia-Pacific (APAC),2015-01-01,year,,,2018-07-09,3020000,USD,3020000,Corporate Round,3020000,USD,3020000,,"J One Capital, JLAB | JD capital, JRR Crypto, Ontology Global Capital, Timestamp Capital",5
Enigio Time AB,https://www.crunchbase.com/organization/enigio-time-ab,"Blockchain, Information Technology","Stockholm, Stockholms Lan, Sweden","European Union (EU), Nordic Countries, Scandinavia",2012-01-01,year,,,2018-12-18,19000000,SEK,2097955,Seed,19000000,SEK,2097955,Seed,Stockhorn Capital,1
Lendflo,https://www.crunchbase.com/organization/lendflo,"Blockchain, Financial Services","London, England, United Kingdom",European Union (EU),2017-01-01,year,,,2018-12-01,600000,GBP,765149,Seed,600000,GBP,765149,Seed,"APEX Ventures, Florian Reike, H-FARM, James McCann, Undisclosed",6
MintHealth,https://www.crunchbase.com/organization/minthealth,"Blockchain, Health Care","San Diego, California, United States","Greater San Diego Area, West Coast, Western US",2017-01-01,year,,,2018-09-11,152741,USD,152741,Equity Crowdfunding,152741,USD,152741,,StartEngine,1
edgescan,https://www.crunchbase.com/organization/edgescan,"Cloud Computing, Cyber Security, SaaS","Dublin, Dublin, Ireland",European Union (EU),2014-01-01,day,,,2019-01-01,650000,EUR,744997,Grant,,,,,Enterprise Ireland,1
INVioU,https://www.crunchbase.com/organization/inviou,"Blockchain, Financial Services, Information Technology","Tel Aviv, Tel Aviv, Israel",,2018-01-01,day,,,2018-11-06,2000000,USD,2000000,Seed,2000000,USD,2000000,Seed,,
PlayGame,https://www.crunchbase.com/organization/playgame,Cryptocurrency,"Singapore, Central Region, Singapore","Asia-Pacific (APAC), Association of Southeast Asian Nations (ASEAN), Southeast Asia",,,,,2018-11-08,7700000,USD,7700000,Initial Coin Offering,7700000,USD,7700000,,,
ACINQ,https://www.crunchbase.com/organization/acinq,Bitcoin,"Paris, Ile-de-France, France",European Union (EU),,,,,2018-10-04,1700000,USD,1700000,Seed,1700000,USD,1700000,Seed,"Alistair Milne, Bertrand Diard, Serena, Sébastien Lucas, Yves Weisselberger",5
Blockchain Studio,https://www.crunchbase.com/organization/blockchain-studio,"Blockchain, Developer Platform, SaaS, Software","Neuilly-sur-seine, Ile-de-France, France",European Union (EU),2018-03-01,day,,,2018-09-07,1900000,EUR,2196785,Seed,1900000,EUR,2196785,Seed,,
"Varius Solutions, Inc.",https://www.crunchbase.com/organization/varius-solutions-inc,"Blockchain, Consulting, Information Technology, Software","Santa Monica, California, United States","Greater Los Angeles Area, West Coast, Western US",,,,,2018-10-29,5000000,USD,5000000,Venture - Series Unknown,5000000,USD,5000000,,,
Guardian Firewall,https://www.crunchbase.com/organization/guardian-mobile-firewall,"Cyber Security, Information Technology, Privacy, Software",,,,,,,2018-11-01,850000,USD,850000,Seed,850000,USD,850000,Seed,Stephen Russell,1
10XTS,https://www.crunchbase.com/organization/10xts,"Artificial Intelligence, Blockchain, Enterprise Software, FinTech, Machine Learning, Software, Software Engineering","Cincinnati, Ohio, United States","Great Lakes, Midwestern US",2017-06-01,day,,,2018-10-01,,,,Series A,,,,Early Stage Venture,LOUD Capital,1
SecureLogix,https://www.crunchbase.com/organization/securelogix,"Analytics, Network Security, Security","San Antonio, Texas, United States",Southern US,1998-01-01,year,,,2018-09-17,1900000,USD,1900000,Grant,4200000,USD,4200000,Late Stage Venture,"First Capital Group, Symantec",2
Irisity AB (publ),https://www.crunchbase.com/organization/mindmancer,"Artificial Intelligence, Physical Security, Security","Gothenburg, Vastra Gotaland, Sweden","European Union (EU), Nordic Countries, Scandinavia",2006-01-01,year,2016-01-18,day,2018-11-01,3000000,USD,3000000,Series B,3000000,USD,3000000,IPO,"Chalmers Ventures AB, JCE Group, Nordnet Bank AB, Start Invest, Sätila Holding",7
EXOCHAIN,https://www.crunchbase.com/organization/exochain-corp,"Biometrics, Biopharma, Blockchain, Clinical Trials, Electronic Health Record (EHR), FinTech, Identity Management, Internet, Legal Tech","Kennebunk, Maine, United States","East Coast, New England, Northeastern US",2017-06-01,day,,,2018-10-15,,,,Series A,,,,Early Stage Venture,,
Centive Technologies Corporation,https://www.crunchbase.com/organization/centive-tech-corp,"Bitcoin, Blockchain, Brand Marketing, Content Marketing, Digital Marketing, E-Commerce, E-Commerce Platforms, Ethereum, Internet, Marketing, Social Media, Social Media Marketing, Social Network","Singapore, Central Region, Singapore","Asia-Pacific (APAC), Association of Southeast Asian Nations (ASEAN), Southeast Asia",2018-04-01,day,,,2018-08-30,35000000,USD,35000000,Initial Coin Offering,35000000,USD,35000000,,,
The Dexon Foundation(DEXON),https://www.crunchbase.com/organization/the-dexon-foundation-dexon,"Cryptocurrency, Non Profit","Taipei, T'ai-pei, Taiwan",Asia-Pacific (APAC),2018-01-01,year,,,2018-08-13,20000000,USD,20000000,Venture - Series Unknown,20000000,USD,20000000,,IDG Capital,1
ContentWatch,https://www.crunchbase.com/organization/contentwatch,"Consumer, Security, Service Industry","Salt Lake City, Utah, United States",Western US,2000-01-01,year,,,2018-09-21,2194643,USD,2194643,Venture - Series Unknown,2194643,USD,2194643,,,
Dapix,https://www.crunchbase.com/organization/dapix,"Blockchain, Information Technology","Denver, Colorado, United States","Greater Denver Area, Western US",,,,,2018-08-01,2250000,USD,2250000,Seed,2250000,USD,2250000,Seed,"Access Venture Partners, Dundee Venture Capital, FirstMile Ventures, Service Provider Capital",4
Bernstein,https://www.crunchbase.com/organization/bernstein,"Bitcoin, Blockchain, Cloud Data Services, Intellectual Property, Legal, SaaS","Munich, Bayern, Germany",European Union (EU),2016-09-01,month,,,2018-07-17,270000,EUR,314637,Seed,270000,EUR,314637,Seed,Motu Ventures,1
Tall Poppy,https://www.crunchbase.com/organization/tall-poppy,"Cyber Security, Employee Benefits, Security","San Francisco, California, United States","San Francisco Bay Area, West Coast, Western US",2018-04-09,day,,,2018-08-04,1000000,USD,1000000,Seed,1000000,USD,1000000,Seed,"Liz Fong-Jones, Y Combinator",2
Bitcoin.com.au,https://www.crunchbase.com/organization/bitcoin-com-au,"Bitcoin, Financial Services, FinTech","Melbourne, Victoria, Australia","Asia-Pacific (APAC), Australasia",2016-01-01,year,,,2018-09-12,3000000,AUD,2151310,Venture - Series Unknown,3000000,AUD,2151310,,"Alium Capital, Dominet Venture Partners, Kucoin",3
Open Health Network,https://www.crunchbase.com/organization/open-health-network,"Analytics, Artificial Intelligence, Big Data, Blockchain, Electronic Health Record (EHR), Health Care, Information Technology, mHealth","Mountain View, California, United States","San Francisco Bay Area, Silicon Valley, West Coast",2013-02-14,day,,,2018-08-06,150000,USD,150000,Seed,150000,USD,150000,Seed,"Barry Zuckerman, Quake Capital Partners, StartUp Health",3
ADAB Solutions,https://www.crunchbase.com/organization/adab-solutions,"Blockchain, Financial Exchanges, FinTech, Internet","Umm Al Qawain, Umm Al Quwain, United Arab Emirates",Gulf Cooperation Council (GCC),2017-01-01,year,,,2018-10-18,1700000,USD,1700000,Series A,1700000,USD,1700000,Early Stage Venture,,
CoinMex,https://www.crunchbase.com/organization/coinmex,"Blockchain, FinTech, Internet","Belize City, Belize, Belize",,2018-01-01,year,,,2018-07-30,,,,Venture - Series Unknown,,,,,"BKFUND, Consensus Lab, Elysium Venture Capital, Fenbushi Capital, Sparkling StarCapital",7
Grey,https://www.crunchbase.com/organization/grey-inc,"Automotive, Bitcoin, Blockchain, Information Technology, Robotics, Software","Dallas, Texas, United States","Dallas/Fort Worth Metroplex, Southern US",2017-11-22,day,,,2018-08-31,1025000,USD,1025000,Seed,1025000,USD,1025000,Seed,,
AlphaNetworks,https://www.crunchbase.com/organization/alphanetworks,"Blockchain, Content Delivery Network, Digital Entertainment, Digital Media, Film, Media and Entertainment, TV, Video on Demand, Video Streaming","Cheyenne, Wyoming, United States",Western US,2017-05-01,month,,,2018-09-18,10000000,USD,10000000,Venture - Series Unknown,10000000,USD,10000000,,"Alphabit Fund, Shuttle Fund, Smart Contract, Inc",3
Swascan,https://www.crunchbase.com/organization/swascan,"Cyber Security, Information Technology, Internet","Cassina De' Pecchi, Lombardia, Italy",European Union (EU),2016-01-01,year,,,2018-10-01,,,,Seed,,,,Seed,"Key Capital, Startupbootcamp, Startupbootcamp FinTech & CyberSecurity",3
VeriSmart,https://www.crunchbase.com/organization/verismart,"Artificial Intelligence, Blockchain, FinTech, Information Technology","California City, California, United States","West Coast, Western US",2015-03-01,day,,,2018-11-01,,,,Non-equity Assistance,40000,USD,40000,Seed,"3S Landing Pad, DIFC FinTech Hive, Piyush gupta, StartersHub, Startupbootcamp Smart City Dubai",6
Zhizhangyi,https://www.crunchbase.com/organization/zhizhangyi,"Internet, Mobile, Network Security, Technical Support","Beijing, Beijing, China",Asia-Pacific (APAC),2013-01-01,year,,,2018-10-15,200000000,CNY,28914687,Series B,200000000,CNY,28914687,Early Stage Venture,"CDF-Capital, China Growth Capital | CGC, F&G Venture, Fosun RZ Capital, Lightspeed China Partners",9
TransitNet,https://www.crunchbase.com/organization/transitnet,"Blockchain, Computer, Cryptocurrency, Network Security","Redondo Beach, California, United States","Greater Los Angeles Area, West Coast, Western US",2018-01-01,year,,,2018-07-11,2500000,USD,2500000,Seed,2500000,USD,2500000,Seed,"Alphabit Fund, BKCM, Kenetic, NextProtocol Ventures, Translunar One",6
JAYA Company,https://www.crunchbase.com/organization/jaya-company,"Artificial Intelligence, Human Computer Interaction, Identity Management, Information Technology, Machine Learning, Software","Omaha, Nebraska, United States",Midwestern US,2018-07-23,day,,,2018-10-01,300000,USD,300000,Seed,300000,USD,300000,Seed,,
Peer Ledger,https://www.crunchbase.com/organization/peer-ledger,"Blockchain, Cryptocurrency, Information Technology, Software, Supply Chain Management, Sustainability","Halifax, Nova Scotia, Canada",,2016-04-07,day,,,2018-09-04,,,,Corporate Round,,,,,PAMP,1
Elkrem,https://www.crunchbase.com/organization/elkrem,"Blockchain, Hardware, Internet of Things, Software","Cairo, Al Qahirah, Egypt",,2018-01-01,year,,,2018-09-08,75000,USD,75000,Seed,75000,USD,75000,Seed,"500 Startups, ConsenSys Ventures, Endure Capital, Flat6Labs, Karim Hussein",8
Cocon,https://www.crunchbase.com/organization/panda-graphics,"Crowdsourcing, Cyber Security","Tokyo, Tokyo, Japan",Asia-Pacific (APAC),2013-02-22,day,,,2018-10-05,28000000,USD,28000000,Venture - Series Unknown,28000000,USD,28000000,,"East Ventures, OPT, SBI Investment, Susquehanna International Group (SIG), YJ Capital",6
Anchor ID,https://www.crunchbase.com/organization/anchor-id-inc,"Biometrics, Blockchain, Cryptocurrency, Cyber Security, Enterprise Software, Identity Management, Mobile, SaaS, Security, Software","Kingston, New York, United States","East Coast, Northeastern US",2014-01-15,day,,,2018-10-01,,,,Non-equity Assistance,300000,USD,300000,Seed,"E Squared Capital Management, Mark Roe, Plug and Play",3
Link Motion,https://www.crunchbase.com/organization/nqmobile,"Android, Apps, Mobile, PaaS, Privacy, SaaS, Security, Software, Wireless","Dongcheng, Shaanxi, China",Asia-Pacific (APAC),2005-10-04,day,2011-05-06,day,2018-07-20,,,,Corporate Round,,,,IPO,"Ceyuan Ventures, China AI Capital, GSR Ventures, Qualcomm, Sequoia Capital",5
"i2Chain, Inc.",https://www.crunchbase.com/organization/i2chain-inc,"Cloud Security, Collaboration, Cyber Security, DRM, E-Signature, Information and Communications Technology (ICT), Information Services, Information Technology","Santa Clara, California, United States","San Francisco Bay Area, Silicon Valley, West Coast",2018-05-09,day,,,2018-07-01,300000,USD,300000,Pre-Seed,300000,USD,300000,Seed,Subba Somala,1
DataBlockchain.io,https://www.crunchbase.com/organization/datablockchain-io,"Blockchain, Information Services, Information Technology, Internet","Deerfield Beach, Florida, United States","Greater Miami Area, East Coast, Southern US",,,,,2018-08-23,16000000,USD,16000000,Initial Coin Offering,16000000,USD,16000000,,,
Advanced TeleSensors,https://www.crunchbase.com/organization/advanced-telesensors,"Fitness, Health Care, Security","Austin, Texas, United States",Southern US,2008-01-01,year,,,2018-07-11,2789793,USD,2789793,Series A,2789793,USD,2789793,Early Stage Venture,,
Hdiv Security,https://www.crunchbase.com/organization/hdiv-security,"Computer, Cyber Security, Network Security","Donostia-san Sebastián, Pais Vasco, Spain",European Union (EU),2016-01-01,year,,,2018-09-18,1000000,USD,1000000,Seed,1000000,USD,1000000,Seed,"Adara Ventures, EASME - EU Executive Agency for SMEs",2
Aspen Digital Security Token,https://www.crunchbase.com/organization/aspen-digital-security-token,Blockchain,"New York, New York, United States","Greater New York Area, East Coast, Northeastern US",,,,,2018-10-09,18000000,USD,18000000,Initial Coin Offering,18000000,USD,18000000,,Elevated Returns,1
Ligo,https://www.crunchbase.com/organization/ligo,"Advice, Identity Management, Legal, Legal Tech, Software","Amsterdam, Noord-Holland, The Netherlands",European Union (EU),2015-09-10,day,,,2018-08-29,500000,EUR,585480,Seed,500000,EUR,585480,Seed,,
Cydarm,https://www.crunchbase.com/organization/cydarm,"Cyber Security, Information Technology, Security","Docklands, Victoria, Australia","Asia-Pacific (APAC), Australasia",2017-10-01,month,,,2018-11-23,500000,AUD,361700,Seed,500000,AUD,361700,Seed,"CyRise, Right Click Capital",2
POINTS,https://www.crunchbase.com/organization/points-80a4,"Blockchain, Financial Services, Service Industry",,,2017-01-01,year,,,2018-07-20,8000000,USD,8000000,Seed,8000000,USD,8000000,Seed,"Ceyuan Ventures, Cherubic Ventures, China Chengxin Credit, DHVC, Nest.Bio Ventures",6
Review.Network,https://www.crunchbase.com/organization/review-network,"Artificial Intelligence, Blockchain, Consumer Reviews, Market Research","Barcelona, Catalonia, Spain",European Union (EU),2018-06-18,day,,,2018-08-14,1400000,USD,1400000,Seed,1400000,USD,1400000,Seed,Sherman Capital Management,1
Debitrum,https://www.crunchbase.com/organization/debitrum,"Blockchain, Financial Services, FinTech","Buffalo, New York, United States","Great Lakes, East Coast, Northeastern US",2018-01-01,day,,,2018-09-01,1500000,USD,1500000,Seed,1500000,USD,1500000,Seed,,
Hannah Systems,https://www.crunchbase.com/organization/hannah-systems,"Automotive, Autonomous Vehicles, Blockchain, Developer APIs, Developer Platform, Information Services, SaaS, Software","San Francisco, California, United States","San Francisco Bay Area, West Coast, Western US",2003-09-01,day,,,2018-10-23,100000,USD,100000,Pre-Seed,100000,USD,100000,Seed,,
Keezel,https://www.crunchbase.com/organization/keezel,"B2B, Cyber Security, Electronics, Hardware, Internet, Network Hardware, Network Security, Security, Software","Amsterdam, Noord-Holland, The Netherlands",European Union (EU),2015-01-01,year,,,2018-09-15,,,,Equity Crowdfunding,,,,,"ABN AMRO Bank, Indiegogo, StartEngine",3
Token IQ,https://www.crunchbase.com/organization/token-iq,"Blockchain, Financial Services, Information Technology, SaaS","Scottsdale, Arizona, United States","Greater Phoenix Area, Western US",2017-01-01,year,,,2018-08-27,1000000,USD,1000000,Seed,1000000,USD,1000000,Seed,Profectus Financial,1
Yanu,https://www.crunchbase.com/organization/yanu,"Artificial Intelligence, Cryptocurrency, Food and Beverage, Leisure, Robotics","Tallinn, Harjumaa, Estonia",European Union (EU),2016-11-01,day,,,2018-09-01,946000,EUR,1098467,Seed,946000,EUR,1098467,Seed,,
Hash Labs,https://www.crunchbase.com/organization/hash-labs-0727,"Cryptocurrency, Information Technology","Miami, Florida, United States","Greater Miami Area, East Coast, Southern US",1997-01-01,year,2001-02-16,day,2018-08-24,766666,USD,766666,Post-IPO Equity,766666,USD,766666,IPO,,
HadePay,https://www.crunchbase.com/organization/odp-solutions-inc,"Blockchain, Cloud Infrastructure, FinTech, Infrastructure, Mobile Payments, Payments, SaaS","Lakeland, Florida, United States","East Coast, Southern US",2017-10-01,day,,,2018-09-10,,,,Series A,,,,Early Stage Venture,,
Amber,https://www.crunchbase.com/organization/amber-37e8,"Cryptocurrency, Finance, FinTech, Virtual Currency","Brisbane, Queensland, Australia","Asia-Pacific (APAC), Australasia",2018-02-06,day,,,2018-08-15,1000000,AUD,723367,Seed,1000000,AUD,723367,Seed,,
MUST Platform,https://www.crunchbase.com/organization/must-platform,"Blockchain, FinTech, Legal Tech, Marketplace","Tallinn, Harjumaa, Estonia",European Union (EU),2018-06-08,day,,,2018-11-01,,,,Seed,,,,Seed,,
Federacy,https://www.crunchbase.com/organization/federacy,"Cyber Security, Internet, Security","San Francisco, California, United States","San Francisco Bay Area, West Coast, Western US",2018-01-01,year,,,2018-08-20,120000,USD,120000,Seed,120000,USD,120000,Seed,Y Combinator,1
"QubeChain, LLC.",https://www.crunchbase.com/organization/qubechain-llc,"Blockchain, Information Services, Information Technology, Virtual Currency","Santa Monica, California, United States","Greater Los Angeles Area, West Coast, Western US",2016-11-22,day,,,2018-09-18,4000000,USD,4000000,Series A,4000000,USD,4000000,Early Stage Venture,"Hudson Morgan Investments, LLC. 2016",1
BioMetric Signature ID,https://www.crunchbase.com/organization/biometric-signature-id,"Biometrics, Identity Management, SaaS, Software","Lewisville, Texas, United States","Dallas/Fort Worth Metroplex, Southern US",1995-01-01,year,,,2018-08-09,,,,Series A,,,,Early Stage Venture,,
Ao Graph,https://www.crunchbase.com/organization/ao-graph,"Information Technology, Internet, Security","Haidian, Beijing, China",Asia-Pacific (APAC),,,,,2018-12-11,100000000,CNY,14492753,Seed,100000000,CNY,14492753,Seed,"Redpoint Ventures China, Sharewin Investment",2
PAXAFE,https://www.crunchbase.com/organization/paxafe,"Security, Software","Milwaukee, Wisconsin, United States","Great Lakes, Midwestern US",2018-09-01,day,,,2018-09-01,300000,USD,300000,Seed,300000,USD,300000,Seed,gener8tor,1
AELER Technologies,https://www.crunchbase.com/organization/aeler-technologies-sa,"Artificial Intelligence, Information and Communications Technology (ICT), Information Technology, Internet of Things, Logistics, Security, Shipping, Supply Chain Management","Lausanne, Vaud, Switzerland",,2018-06-01,month,,,2018-12-01,300000,USD,300000,Pre-Seed,300000,USD,300000,Seed,,
"Knock Software, Inc",https://www.crunchbase.com/organization/knock-software-inc,"Security, Software","Portland, Oregon, United States","West Coast, Western US",2013-04-01,day,,,2018-10-18,2600000,USD,2600000,Venture - Series Unknown,2600000,USD,2600000,,,
BASU.COM,https://www.crunchbase.com/organization/robocopp,"Public Safety, Security, Wearables","Orinda, California, United States","San Francisco Bay Area, West Coast, Western US",2015-04-01,month,,,2018-07-05,400000,USD,400000,Seed,400000,USD,400000,Seed,Marcus Lange,1
Sytorus,https://www.crunchbase.com/organization/sytorus,"Cyber Security, Information Services, Security","Dublin, Dublin, Ireland",European Union (EU),2013-01-01,year,,,2018-09-06,1700000,EUR,1975356,Venture - Series Unknown,1700000,EUR,1975356,,"Enterprise Ireland, Kernel Capital",2
GlobeKeeper,https://www.crunchbase.com/organization/globekeeper,"Communication Hardware, Messaging, Security","Mountain View, California, United States","San Francisco Bay Area, Silicon Valley, West Coast",2014-08-01,day,,,2018-12-27,,,,Pre-Seed,,,,Seed,"500 Startups, TAU Ventures",2
keychain,https://www.crunchbase.com/organization/keychain,"Blockchain, Cyber Security, Financial Services, Information Technology, Security","Singapore, Central Region, Singapore","Asia-Pacific (APAC), Association of Southeast Asian Nations (ASEAN), Southeast Asia",,,,,2018-09-24,1000000,USD,1000000,Series A,1000000,USD,1000000,Early Stage Venture,"IDATEN Ventures, Monex Ventures",2
CoinText,https://www.crunchbase.com/organization/cointext,"Bitcoin, Cryptocurrency, Transaction Processing, Virtual Currency","Nashua, New Hampshire, United States","East Coast, New England, Northeastern US",2018-01-01,year,,,2018-07-02,600000,USD,600000,Seed,600000,USD,600000,Seed,Yeoman's Capital,1
Carnival Assets Management Company Limited,https://www.crunchbase.com/organization/carnival-assets-management-company-limited,"Blockchain, Cryptocurrency, FinTech, Information and Communications Technology (ICT), Social Media","North Point, Hong Kong Island, Hong Kong",Asia-Pacific (APAC),2016-11-14,day,,,2018-10-01,2260000,HKD,288681,Pre-Seed,2260000,HKD,288681,Seed,"How Ming Chau, Ming Tsang",2
Superorder,https://www.crunchbase.com/organization/superorder,"Cryptocurrency, Trading Platform","Kyiv, Kyyiv, Ukraine",,2018-07-01,day,,,2018-08-20,500000,USD,500000,Seed,500000,USD,500000,Seed,SMRK VC Fund,1
Criptalia,https://www.crunchbase.com/organization/criptalia,"Blockchain, Cryptocurrency, Finance, Financial Services, FinTech","Bergamo, Lombardia, Italy",European Union (EU),2018-02-15,day,,,2018-10-01,320000,EUR,370467,Seed,320000,EUR,370467,Seed,,
Fortr3ss,https://www.crunchbase.com/organization/fortr3ss,"Apps, Security","Miami, Florida, United States","Greater Miami Area, East Coast, Southern US",2015-08-05,day,,,2018-12-08,500000,USD,500000,Seed,500000,USD,500000,Seed,,
SmartUp,https://www.crunchbase.com/organization/smartup-b539,"Blockchain, Information Technology, Service Industry","Hong Kong, Hong Kong Island, Hong Kong",Asia-Pacific (APAC),,,,,2018-09-11,,,,Corporate Round,,,,,"Blockchain Japan, DCapital, Soul Capital",3
Witnet Foundation,https://www.crunchbase.com/organization/witnet-foundation,"Blockchain, Internet, Software","Madrid, Madrid, Spain",European Union (EU),2017-01-01,year,,,2018-08-16,3000000,USD,3000000,Venture - Series Unknown,3000000,USD,3000000,,"James Sowers, Reflective Venture Partners",2
Guard Grabber Technologies Inc.,https://www.crunchbase.com/organization/guard-grabber-technologies-inc,"Apps, Mobile Apps, Physical Security, Real Time, Security","Santa Barbara, California, United States","West Coast, Western US",2018-07-03,day,,,2018-09-14,1000000,USD,1000000,Seed,1000000,USD,1000000,Seed,,
Fluida Europe,https://www.crunchbase.com/organization/fluida-europe,"Analytics, Artificial Intelligence, Blockchain, Human Resources, SaaS","Milan, Lombardia, Italy",European Union (EU),2018-03-28,day,,,2018-09-30,400000,EUR,464206,Pre-Seed,400000,EUR,464206,Seed,,
Foilchat Oy,https://www.crunchbase.com/organization/foilchat-oy,"Apps, Cyber Security, Enterprise Software, Messaging","Espoo, Southern Finland, Finland","European Union (EU), Nordic Countries, Scandinavia",2013-11-01,month,,,2018-07-01,1000000,EUR,1167951,Seed,1000000,EUR,1167951,Seed,,
ArcusTeam,https://www.crunchbase.com/organization/arcusteam,"Android, Artificial Intelligence, Big Data, Cyber Security, Internet of Things, iOS, Linux","Tel Aviv-yafo, Tel Aviv, Israel",,2018-01-01,year,,,2018-11-01,300000,USD,300000,Pre-Seed,300000,USD,300000,Seed,TAU Ventures,1
SimpleSense,https://www.crunchbase.com/organization/simplesense,"Public Safety, Security","Erie, Pennsylvania, United States","Great Lakes, Northeastern US",2017-10-02,day,,,2018-12-19,250000,USD,250000,Pre-Seed,250000,USD,250000,Seed,"Ben Franklin Technology Partners of Central and Northern Pennsylvania, Erie Insurance, InNEVator, Secure Erie Accelerator, Sierra Innovations",5
Translo,https://www.crunchbase.com/organization/translo,"Blockchain, Health Care, Medical","Boston, Massachusetts, United States","Greater Boston Area, East Coast, New England",2018-07-18,day,,,2018-08-08,2000000,USD,2000000,Seed,2000000,USD,2000000,Seed,Reflective Venture Partners,1
SecureStack,https://www.crunchbase.com/organization/securestack,"Cloud Infrastructure, Cloud Security, Cyber Security, SaaS","Gold Coast, Queensland, Australia","Asia-Pacific (APAC), Australasia",2017-11-07,day,,,2018-11-15,50000,AUD,36350,Pre-Seed,50000,AUD,36350,Seed,CyRise,1
TAIKAI,https://www.crunchbase.com/organization/taikai,"Blockchain, Innovation Management, SaaS","Oporto, Porto, Portugal",European Union (EU),2018-08-01,day,,,2018-08-01,350000,EUR,408187,Pre-Seed,350000,EUR,408187,Seed,Bright Pixel,1
MaterialsZone,https://www.crunchbase.com/organization/materialszone,"Blockchain, Information Services, Information Technology","Tel Aviv, Tel Aviv, Israel",,2017-01-01,year,,,2018-07-24,1000000,USD,1000000,Seed,1000000,USD,1000000,Seed,Sarona Ventures,1
CoinGenius,https://www.crunchbase.com/organization/coingenius,"Artificial Intelligence, Bitcoin, Blockchain, Cryptocurrency, FinTech, Machine Learning, Predictive Analytics","Rancho Santa Margarita, California, United States","Greater Los Angeles Area, West Coast, Western US",2018-08-08,day,,,2018-08-08,200000,USD,200000,Pre-Seed,200000,USD,200000,Seed,,
