Insignary,https://www.crunchbase.com/organization/insignary,"Information Technology, Open Source, Security, Supply Chain Management","Seoul, Seoul-t'ukpyolsi, South Korea",Asia-Pacific (APAC),2016-01-01,year,,,2018-08-20,,,,Corporate Round,,,,,"BearingPoint, Mega Investment, SGI Venture Capital",3
Cashlink,https://www.crunchbase.com/organization/cashlink,"Cryptocurrency, Financial Services, FinTech, Venture Capital","Frankfurt, Hessen, Germany",European Union (EU),2016-01-01,year,,,2018-11-21,,,,Seed,,,,Seed,"Dr. Rainer Zimmermann, FinLab, Seed & Speed Ventures",3
Blocksmith,https://www.crunchbase.com/organization/blocksmith,Blockchain,"London, England, United Kingdom",European Union (EU),2018-01-01,year,,,2018-07-03,50000,GBP,65968,Seed,50000,GBP,65968,Seed,KR1,1
31°N,https://www.crunchbase.com/organization/31-n,"Blockchain, Media and Entertainment","Beijing, Beijing, China",Asia-Pacific (APAC),2018-01-01,year,,,2018-12-26,290000,USD,290000,Seed,290000,USD,290000,Seed,QUBI,1
Dekko Secure,https://www.crunchbase.com/organization/dekko-secure,"Information Services, Security","Sydney, New South Wales, Australia","Asia-Pacific (APAC), Australasia",2013-11-01,day,,,2018-12-05,50000,AUD,36323,Seed,50000,AUD,36323,Seed,CyRise,1
Good Money Group,https://www.crunchbase.com/organization/good-money-group,Cryptocurrency,"Austin, Texas, United States",Southern US,,,,,2018-10-08,22000000,USD,22000000,Convertible Note,,,,,,
Pynk,https://www.crunchbase.com/organization/pynk,"Banking, Blockchain, Cryptocurrency, FinTech, Hedge Funds, Software","London, England, United Kingdom",European Union (EU),2018-05-01,month,,,2018-10-20,,,,Pre-Seed,,,,Seed,Loyal.VC,1
Iotex,https://www.crunchbase.com/organization/iotex,"Blockchain, Information Technology, Internet of Things","Menlo Park, California, United States","San Francisco Bay Area, Silicon Valley, West Coast",2017-01-01,year,,,2018-11-01,,,,Venture - Series Unknown,,,,,"8 Decimal Capital, BlockVC, Connect Capital, Founder Friendly Labs, NEO Global Capital (NGC)",6
everiToken,https://www.crunchbase.com/organization/everitoken,"Bitcoin, Blockchain","Tanggu, Tianjin, China",Asia-Pacific (APAC),2018-01-01,year,,,2018-08-07,2000000,USD,2000000,Seed,2000000,USD,2000000,Seed,"ChainFunder, Fenbushi Capital",2
Banyan,https://www.crunchbase.com/organization/banyanops,"Analytics, Computer, Security, Software","San Francisco, California, United States","San Francisco Bay Area, West Coast, Western US",2015-06-01,day,,,2018-08-01,,,,Seed,,,,Seed,"Bogomil Balkansky, DHVC, StartX (Stanford-StartX Fund), Unusual Ventures",4
BitCV,https://www.crunchbase.com/organization/bitcv,"Blockchain, Mobile Payments","Beijing, Beijing, China",Asia-Pacific (APAC),2018-01-01,year,,,2018-07-06,1507000,USD,1507000,Seed,1507000,USD,1507000,Seed,Zhiwei Li,1
KORK,https://www.crunchbase.com/organization/kork,"Apps, Artificial Intelligence, Blockchain, Cloud Data Services, Data Integration, Data Mining, Data Storage, Database, Developer APIs, Digital Marketing, Geospatial, Market Research, Marketing, Marketplace, Mobile Advertising, Mobile Apps, Personal Finance, Personalization, Privacy, Private Social Networking, Security","Washington, District of Columbia, United States","Washington DC Metro Area, Southern US",2017-10-22,day,,,2018-07-23,,,,Seed,,,,Seed,Stoic Capital,1
Pacific Northwest National Laboratory,https://www.crunchbase.com/organization/pacific-northwest-national-laboratory,"Biomass Energy, Energy, Government, Product Research, Security","Richland, Washington, United States","West Coast, Western US",1965-01-01,year,,,2018-07-16,,,,Grant,,,,,US Department of Energy,1
Bloqboard,https://www.crunchbase.com/organization/bloqboard,"Blockchain, Cryptocurrency, Ethereum, Financial Services","San Francisco, California, United States","San Francisco Bay Area, West Coast, Western US",2018-01-01,year,,,2018-09-01,,,,Seed,,,,Seed,Polychain,1
Vetty,https://www.crunchbase.com/organization/vetty,"Blockchain, Compliance, Human Resources","New York, New York, United States","Greater New York Area, East Coast, Northeastern US",,,,,2018-07-21,,,,Seed,,,,Seed,"3Lines, Newark Venture Partners, Stout Street Capital",3
Hash Incubator,https://www.crunchbase.com/organization/hash-incubator,"Blockchain, Venture Capital","Shanghai, Shanghai, China",Asia-Pacific (APAC),2018-01-01,year,,,2018-07-12,2000000,USD,2000000,Angel,2000000,USD,2000000,Seed,"23Seed, JRR Crypto, Next Blockchain Capital",3
Tribal Rides,https://www.crunchbase.com/organization/tribal-rides,"Automotive, Blockchain, Software","San Francisco, California, United States","San Francisco Bay Area, West Coast, Western US",2015-01-01,year,,,2018-11-13,10350,USD,10350,Equity Crowdfunding,10350,USD,10350,,StartEngine,1
Panopta,https://www.crunchbase.com/organization/panopta,"Information Technology, Network Security, Web Hosting","Chicago, Illinois, United States","Greater Chicago Area, Great Lakes, Midwestern US",2007-09-01,day,,,2018-11-15,,,,Venture - Series Unknown,,,,,"Five Elms Capital, Lighter Capital",2
RealtyBits,https://www.crunchbase.com/organization/realtybits-palo-alto-calfornia,"Blockchain, Commercial Real Estate, Finance, Real Estate, Real Estate Investment","Palo Alto, California, United States","San Francisco Bay Area, Silicon Valley, West Coast",2018-01-01,year,,,2018-08-21,,,,Seed,,,,Seed,"Coinbase Ventures, Entrée Capital, Finistere Ventures, Scrum Ventures, Y Combinator",10
OpenFinance Network,https://www.crunchbase.com/organization/openfinance-network,"Cryptocurrency, Trading Platform","Chicago, Illinois, United States","Greater Chicago Area, Great Lakes, Midwestern US",,,,,2018-10-24,,,,Venture - Series Unknown,,,,,"Huobi, Sharpe Ventures",2
Offensive Security,https://www.crunchbase.com/organization/offensive-security,"Cyber Security, Information Technology, Security","New York, New York, United States","Greater New York Area, East Coast, Northeastern US",,,,,2018-09-04,,,,Private Equity,,,,Private Equity,"Spectrum Equity, TenEleven Ventures",2
Snack Videos,https://www.crunchbase.com/organization/snack-video-technologies-inc,"Compliance, E-Learning, Education, Training, Video","Seattle, Washington, United States","Greater Seattle Area, West Coast, Western US",2018-07-26,day,,,2018-08-31,,,,Seed,,,,Seed,Sogou,1
KOOBANK China,https://www.crunchbase.com/organization/koobank-china,Blockchain,"Beijing, Beijing, China",Asia-Pacific (APAC),2017-01-01,year,,,2018-07-23,37000000,CNY,5447986,Series A,37000000,CNY,5447986,Early Stage Venture,"Jiuniu Investment, Yunshan Capital Partners",2
ExpoCore,https://www.crunchbase.com/organization/expocore,"Blockchain, Trading Platform, Transaction Processing","Shanghai, Shanghai, China",Asia-Pacific (APAC),2017-01-01,month,,,2018-07-01,150000,USD,150000,Seed,150000,USD,150000,Seed,,
Zhangyu Technology,https://www.crunchbase.com/organization/zhangyu-technology,"Blockchain, Information Technology","Shanghai, Shanghai, China",Asia-Pacific (APAC),2013-01-01,year,,,2018-09-14,291941,USD,291941,Seed,291941,USD,291941,Seed,Fundamental Labs,1
Shrimpy,https://www.crunchbase.com/organization/benthos-labs-inc,"Blockchain, FinTech","Santa Clara, California, United States","San Francisco Bay Area, Silicon Valley, West Coast",2018-01-28,day,,,2018-08-10,,,,Pre-Seed,,,,Seed,"Oriza Ventures, Plug and Play",2
Numbers,https://www.crunchbase.com/organization/numbers-5de4,"Artificial Intelligence, Big Data, Machine Learning, Security","Benin City, Edo, Nigeria",,2018-10-25,day,,,2018-12-02,3424,USD,3424,Pre-Seed,3424,USD,3424,Seed,,
Biplusplus,https://www.crunchbase.com/organization/biplusplus,Blockchain,"Beijing, Beijing, China",Asia-Pacific (APAC),2016-01-01,year,,,2018-08-02,10000000,CNY,1461283,Angel,10000000,CNY,1461283,Seed,"Ether Capital, Funcity Capital, Shunya International",3
Watchful,https://www.crunchbase.com/organization/watchful-io,"Big Data, Cyber Security, Infrastructure, Real Time, Text Analytics","San Francisco, California, United States","San Francisco Bay Area, West Coast, Western US",2016-11-01,month,,,2018-07-12,,,,Convertible Note,,,,,ff Venture Capital,1
EON Protocol,https://www.crunchbase.com/organization/eon-protocol,Blockchain,"Beijing, Beijing, China",Asia-Pacific (APAC),2018-01-01,year,,,2018-07-13,2000000,USD,2000000,Angel,2000000,USD,2000000,Seed,"BGOGO, Fission Capital, UpHonest Capital",3
Quanterium,https://www.crunchbase.com/organization/quanterium,"Cryptocurrency, FinTech, Information Technology","London, England, United Kingdom",European Union (EU),2018-03-01,month,,,2019-01-01,,,,Seed,,,,Seed,Founders Factory,1
Jonga,https://www.crunchbase.com/organization/jonga,"Information Technology, Security","Cape Town, NA - South Africa, South Africa",,,,,,2018-12-07,654000,ZAR,46172,Grant,,,,,Technology Innovation Agency,1
TimeChain,https://www.crunchbase.com/organization/timechain-1a59,Blockchain,"Hangzhou, Zhejiang, China",Asia-Pacific (APAC),2017-01-01,year,,,2018-08-14,291000,USD,291000,Angel,291000,USD,291000,Seed,"Wu Bin, Xu Hanjie",2
Jassby,https://www.crunchbase.com/organization/jassby,"Apps, Cryptocurrency, E-Commerce, Financial Services, FinTech, Mobile Apps, Mobile Payments","Waltham, Massachusetts, United States","Greater Boston Area, East Coast, New England",,,,,2018-10-17,,,,Venture - Series Unknown,,,,,"Blumberg Capital, Correlation Ventures, Moneta Ventures, PRYTEK",4
MTonomy,https://www.crunchbase.com/organization/mtonomy,"Blockchain, Internet, Media and Entertainment","Cambridge, Massachusetts, United States","Greater Boston Area, East Coast, New England",2018-01-01,year,,,2018-10-20,,,,Undisclosed,,,,,"Jack Dorsey, Valor Capital Group",2
Acceptto,https://www.crunchbase.com/organization/acceptto-corporation,"Cyber Security, Network Security, Software","Portland, Oregon, United States","West Coast, Western US",2013-01-01,year,,,2018-11-28,,,,Series A,,,,Early Stage Venture,Celeres Investments,1
Doordeck,https://www.crunchbase.com/organization/doordeck,"Artificial Intelligence, Cloud Infrastructure, Communication Hardware, Internet of Things, Mobile, SaaS, Security","London, England, United Kingdom",European Union (EU),2015-03-10,day,,,2018-11-01,,,,Angel,,,,Seed,"Startup Funding Club, Startupbootcamp",2
GitGuardian,https://www.crunchbase.com/organization/gitguardian,"Cloud Security, Computer, Cyber Security, Software","Paris, Ile-de-France, France",European Union (EU),2017-11-01,month,,,2018-08-01,,,,Seed,,,,Seed,Fly Ventures,1
HASH,https://www.crunchbase.com/organization/hash-2,"Artificial Intelligence, Business Intelligence, Data Integration, Data Visualization, Machine Learning, Security, Simulation","Manhattan, New York, United States","Greater New York Area, East Coast, Northeastern US",2019-01-01,month,,,2019-01-01,,,,Seed,,,,Seed,"Joel Spolsky, Soho Strategy",2
Origo Network,https://www.crunchbase.com/organization/origo-network,"Blockchain, Cyber Security, Privacy, Security","Newark, California, United States","San Francisco Bay Area, Silicon Valley, West Coast",,,,,2018-08-07,,,,Venture - Series Unknown,,,,,"Connect Capital, Consensus Lab, Nirvana Capital",3
Tunnel,https://www.crunchbase.com/organization/tunnel,"Banking, Blockchain, FinTech, Payments","Boston, Massachusetts, United States","Greater Boston Area, East Coast, New England",2017-12-01,day,,,2018-12-15,,,,Seed,,,,Seed,"Boston Harbor Angels, Colony Hills Capital, EQx Fund, Tomahawk Group, Wilmington Investor Network",5
Panther Labs,https://www.crunchbase.com/organization/panther-labs,"Cloud Security, Cyber Security, Software","San Francisco, California, United States","San Francisco Bay Area, West Coast, Western US",2018-08-01,month,,,2018-11-14,,,,Seed,,,,Seed,S28 Capital,1
Base Operations,https://www.crunchbase.com/organization/base-operations,"Big Data, Information Technology, Security, Software, Travel","Washington, District of Columbia, United States","Washington DC Metro Area, Southern US",2018-04-01,month,,,2018-10-01,,,,Seed,,,,Seed,"Glasswing Ventures, Good Growth Capital, Magma Partners, Techstars, Vela Partners",5
DeskViz,https://www.crunchbase.com/organization/deskviz,"Blockchain, Cryptocurrency, Enterprise Applications, Enterprise Software, Information Technology, Mobile Apps, Software, Software Engineering","Ohio, Illinois, United States","Great Lakes, Midwestern US",2017-01-01,year,,,2018-07-20,157000,USD,157000,Seed,157000,USD,157000,Seed,,
Secure AI Labs,https://www.crunchbase.com/organization/secure-ai-labs,"Analytics, Artificial Intelligence, Computer, Information Technology, Machine Learning, Network Security, Privacy","Cambridge, Massachusetts, United States","Greater Boston Area, East Coast, New England",2017-01-01,year,,,2018-09-08,,,,Non-equity Assistance,,,,,MIT delta v,1
News.one,https://www.crunchbase.com/organization/news-one,Blockchain,"Beijing, Beijing, China",Asia-Pacific (APAC),2018-01-01,year,,,2018-08-06,292300,USD,292300,Angel,292300,USD,292300,Seed,Node Capital,1
Maoqi Technology,https://www.crunchbase.com/organization/maoqi-technology,"Blockchain, Information Technology",,,,,,,2018-08-31,10000000,USD,10000000,Series A,10000000,USD,10000000,Early Stage Venture,,
GBLS,https://www.crunchbase.com/organization/gbls,Blockchain,"Hangzhou, Zhejiang, China",Asia-Pacific (APAC),2018-01-01,year,,,2018-12-04,300000,USD,300000,Seed,300000,USD,300000,Seed,Geekbeans Capital,1
RIPS Technologies,https://www.crunchbase.com/organization/rips-technologies,"B2B, Cyber Security, Developer Tools, Enterprise Applications, Enterprise Software, Information Technology, Security, Software, Web Apps, Web Development","Bochum, Nordrhein-Westfalen, Germany",European Union (EU),2016-01-01,year,,,2018-10-02,,,,Series A,,,,Early Stage Venture,eCAPITAL entrepreneurial Partners AG,1
Wanchain,https://www.crunchbase.com/organization/wanchain,"Blockchain, Infrastructure, Internet","Singapore, Central Region, Singapore","Asia-Pacific (APAC), Association of Southeast Asian Nations (ASEAN), Southeast Asia",2017-01-01,year,,,2018-09-03,,,,Seed,,,,Seed,"8 Decimal Capital, Connect Capital, Cypher Capital, Kingsley Advani, Limitless Crypto Investments",5
Cyber Intelligence House,https://www.crunchbase.com/organization/cyber-intelligence-house,"Analytics, Artificial Intelligence, Cyber Security, Information Technology, Machine Learning, Real Time","Singapore, Central Region, Singapore","Asia-Pacific (APAC), Association of Southeast Asian Nations (ASEAN), Southeast Asia",2015-01-01,year,,,2018-12-10,,,,Seed,,,,Seed,Wavemaker Partners,1
Dispatch,https://www.crunchbase.com/organization/dispatch-labs,Blockchain,"San Francisco, California, United States","San Francisco Bay Area, West Coast, Western US",2017-10-01,day,,,2018-11-20,,,,Venture - Series Unknown,,,,,Fenbushi Digital,1
Alphaslot,https://www.crunchbase.com/organization/alphaslot,"Blockchain, Digital Entertainment, Gaming","Hong Kong, Hong Kong Island, Hong Kong",Asia-Pacific (APAC),2018-07-01,month,,,2018-10-01,,,,Corporate Round,,,,,"Credito Capital, Primitive Ventures, Shinobi Capital, Sora Ventures, TRG Capital (Token Research Group)",5
Portal,https://www.crunchbase.com/organization/tides,"Bitcoin, Blockchain, Cryptocurrency, Financial Services, FinTech","San Francisco, California, United States","San Francisco Bay Area, West Coast, Western US",2018-08-01,month,,,2018-12-01,,,,Pre-Seed,,,,Seed,"Apneet Jolly, Arjun Dev Arora, Monday Capital, Tom Ding, Trevor Koverko",6
Endereum,https://www.crunchbase.com/organization/endereum,Blockchain,"Shenzhen, Guangdong, China",Asia-Pacific (APAC),2018-01-01,year,,,2018-09-26,1000000,USD,1000000,Seed,1000000,USD,1000000,Seed,,
ChargingLedger,https://www.crunchbase.com/organization/chargingledger,"Blockchain, Electric Vehicle, Energy, Power Grid, Smart Cities","New York, New York, United States","Greater New York Area, East Coast, Northeastern US",2018-01-01,year,,,2018-12-04,,,,Pre-Seed,,,,Seed,AngelPad,1
AUTHADA,https://www.crunchbase.com/organization/authada-gmbh,"Cyber Security, E-Commerce, Telecommunications","Darmstadt, Hessen, Germany",European Union (EU),2015-01-01,year,,,2018-08-21,,,,Venture - Series Unknown,,,,,"FinLab, Main Incubator",2
BookIn.cn,https://www.crunchbase.com/organization/bookin-cn,Blockchain,"Hangzhou, Zhejiang, China",Asia-Pacific (APAC),2014-01-01,year,,,2018-09-07,2925388,USD,2925388,Series A,2925388,USD,2925388,Early Stage Venture,"Haipeng Hedao Fund, QC Capital",2
Kognition,https://www.crunchbase.com/organization/kognition,"Artificial Intelligence, Blockchain, Cyber Security, Enterprise Software, Internet of Things, Physical Security, Smart Building, Smart Cities","Philadelphia, Pennsylvania, United States","Greater Philadelphia Area, Great Lakes, Northeastern US",2017-01-01,year,,,2018-07-09,,,,Seed,,,,Seed,"Alumni Ventures Group, AVG First Check Fund, Ben Franklin Technology Partners of Southeastern Pennsylvania, Dreamit Ventures",4
Galileo Platforms,https://www.crunchbase.com/organization/galileo-platforms-limited,"Blockchain, FinTech, InsurTech","Sheung Wan, Hong Kong Island, Hong Kong",Asia-Pacific (APAC),2016-05-01,month,,,2018-09-28,,,,Series A,,,,Early Stage Venture,Greenlight Reinsurance,1
Levl Technologies,https://www.crunchbase.com/organization/levl-technologies,"Cyber Security, Information Technology, Internet of Things, Security, Sensor","Santa Clara, California, United States","San Francisco Bay Area, Silicon Valley, West Coast",2016-01-01,year,,,2019-01-01,,,,Seed,,,,Seed,Ubiquity Ventures,1
Scylla,https://www.crunchbase.com/organization/scylla-by-develandoo,"Artificial Intelligence, Cyber Security, Fraud Detection, Intelligent Systems, Intrusion Detection","München, Bayern, Germany",European Union (EU),2018-01-01,year,,,2018-09-12,,,,Seed,,,,Seed,Startupbootcamp,1
CyGov,https://www.crunchbase.com/organization/cygov-intelligent-cyber-security,"CRM, Information Technology, Security","New York, New York, United States","Greater New York Area, East Coast, Northeastern US",2016-01-01,year,,,2018-11-01,,,,Seed,,,,Seed,SixThirty CYBER,1
BULVRD,https://www.crunchbase.com/organization/bulvrd,"Advertising, Advertising Platforms, Analytics, Android, Augmented Reality, Big Data, Blockchain, Ethereum, Geospatial, GPS, iOS, Location Based Services, Machine Learning, Mapping Services, Mobile, Mobile Advertising, Mobile Apps, Navigation, Predictive Analytics, Smart Cities","Merrifield, Virginia, United States","Washington DC Metro Area, East Coast, Southern US",2018-08-01,day,,,2018-09-01,,,,Pre-Seed,,,,Seed,ConsenSys Ventures,1
Enforcd,https://www.crunchbase.com/organization/enforcd,"Artificial Intelligence, Compliance, Corporate Training, E-Learning, Financial Services, Information Services, Machine Learning, Risk Management","London, England, United Kingdom",European Union (EU),2015-10-01,day,,,2018-09-06,,,,Venture - Series Unknown,,,,,Tech Nation Fintech,1
Floating Point Group,https://www.crunchbase.com/organization/floating-point-group,"Analytics, Artificial Intelligence, Cryptocurrency, Financial Services, FinTech, Machine Learning, Software","New York, New York, United States","Greater New York Area, East Coast, Northeastern US",2017-12-01,month,,,2018-09-08,,,,Non-equity Assistance,,,,,MIT delta v,1
SDG Corporation (TruOps),https://www.crunchbase.com/organization/sdg-corporation,"Cloud Security, CMS, IT Management, Risk Management","Norwalk, Connecticut, United States","East Coast, New England, Northeastern US",1993-01-01,year,2008-03-11,day,2018-10-02,,,,Venture - Series Unknown,,,,M&A,Petros Partners,1
Tarsier,https://www.crunchbase.com/organization/tarsier-3ac5,"Artificial Intelligence, B2B, Computer Vision, Drones, Homeland Security, Machine Learning, National Security, Physical Security, Security, Software","San Francisco, California, United States","San Francisco Bay Area, West Coast, Western US",,,,,2018-12-10,,,,Seed,,,,Seed,"Alchemist Accelerator, Diehl Ventures, Stanford Angels and Entrepreneurs",3
Insula Investment Management,https://www.crunchbase.com/organization/inusulα-investment-management,Cryptocurrency,"London, England, United Kingdom",European Union (EU),2018-12-17,day,,,2018-12-17,,,,Pre-Seed,,,,Seed,Insula Investment Management,1
FortifyData,https://www.crunchbase.com/organization/fortifydata,"Cyber Security, FinTech, Network Security, Risk Management, Security","Kennesaw, Georgia, United States","Greater Atlanta Area, East Coast, Southern US",2015-05-01,day,,,2018-10-04,,,,Seed,,,,Seed,Startupbootcamp FinTech & CyberSecurity,1
Goworker,https://www.crunchbase.com/organization/findme-2eca,"Blockchain, E-Commerce, Human Resources, Mobile, SaaS, Software","Brisbane, Queensland, Australia","Asia-Pacific (APAC), Australasia",2018-08-28,day,,,2018-12-01,50,AUD,36,Angel,50,AUD,36,Seed,,
VinX,https://www.crunchbase.com/organization/vinx,"Blockchain, Consumer, E-Commerce, Financial Services, FinTech, Internet, Wine And Spirits","Tel Aviv-yafo, Tel Aviv, Israel",,2017-09-01,month,,,2018-10-05,,,,Seed,,,,Seed,Medici Ventures,1
Routeique .,https://www.crunchbase.com/organization/routeique-inc,"Artificial Intelligence, Blockchain, Delivery, Internet of Things, Logistics, Machine Learning, SaaS, Supply Chain Management, Transportation","Calgary, Alberta, Canada",,2016-08-05,day,,,2018-08-02,,,,Convertible Note,,,,Seed,gener8tor,1
PPC Protect,https://www.crunchbase.com/organization/ppc-protect,"Advertising, CRM, Cyber Security, Security","Bolton, Bolton, United Kingdom",European Union (EU),2016-06-28,day,,,2018-12-07,,,,Venture - Series Unknown,,,,,Rising Stars,1
BlockVigil,https://www.crunchbase.com/organization/blockvigil,"Blockchain, Cryptocurrency, Developer APIs, Developer Tools, Ethereum, SaaS","San Francisco, California, United States","San Francisco Bay Area, West Coast, Western US",2018-01-01,year,,,2018-11-15,,,,Seed,,,,Seed,500 Startups,1
Caiyi Store,https://www.crunchbase.com/organization/caiyi-store,"Bitcoin, Blockchain, Cryptocurrency","Jinan, Shandong, China",Asia-Pacific (APAC),2017-01-01,year,,,2018-07-04,753300,USD,753300,Angel,753300,USD,753300,Seed,"QingCloud Enterprise Management, Vision Capital",2
Qwil Messenger,https://www.crunchbase.com/organization/qwil-messenger,"Messaging, SaaS, Security","London, England, United Kingdom",European Union (EU),2017-03-03,day,,,2018-10-09,,,,Seed,,,,Seed,Schroders,1
Autonomous Partners,https://www.crunchbase.com/organization/autonomous-partners,Cryptocurrency,"San Francisco, California, United States","San Francisco Bay Area, West Coast, Western US",2017-01-01,year,,,2018-07-16,,,,Initial Coin Offering,,,,,Cohen Private Ventures,1
Arianee,https://www.crunchbase.com/organization/arianee,"Blockchain, Information Technology","Paris, Ile-de-France, France",European Union (EU),2018-01-01,year,,,2018-08-02,,,,Venture - Series Unknown,,,,,BlockWater Management,1
Token Group,https://www.crunchbase.com/organization/token-group,"Blockchain, Consulting, Cryptocurrency, Financial Services, FinTech, Information Technology, Internet, Software","Beverly Hills, California, United States","Greater Los Angeles Area, West Coast, Western US",2018-06-01,day,,,2018-11-26,,,,Seed,,,,Seed,,
ARPA,https://www.crunchbase.com/organization/arpa,"Big Data, Computer, Information Technology, Network Hardware, Network Security, Software","Beijing, Beijing, China",Asia-Pacific (APAC),2017-01-01,year,,,2018-08-20,,,,Angel,,,,Seed,"Arrington XRP Capital, Coefficient Ventures, Connect Capital, GBIC, Ledger Capital",6
IRIS Payment Solutions,https://www.crunchbase.com/organization/iris-payment-solutions,"Biometrics, Cryptocurrency, Financial Services, FinTech, Identity Management","London, England, United Kingdom",European Union (EU),2017-11-01,month,,,2019-01-01,,,,Seed,,,,Seed,,
Blinking,https://www.crunchbase.com/organization/blinking,"Blockchain, Information Technology, Internet","Beograd, Vojvodina, Serbia",,2017-10-01,day,,,2018-11-01,,,,Non-equity Assistance,,,,,DIFC FinTech Hive,1
DeepView,https://www.crunchbase.com/organization/deepview,"Cyber Security, Network Security","London, England, United Kingdom",European Union (EU),2013-01-01,year,,,2018-09-10,,,,Seed,,,,Seed,CyLon,1
Be12 Swiss DataBank,https://www.crunchbase.com/organization/be12-swiss-databank,"Computer, Network Security","Luzern, Luzern, Switzerland",,2015-01-01,year,,,2018-08-01,71429,EUR,83304,Grant,,,,,EASME - EU Executive Agency for SMEs,1
DeepBrain Chain,https://www.crunchbase.com/organization/deepbrain-chain,"Analytics, Artificial Intelligence, Blockchain, Information Technology, Robotics","Singapore, Central Region, Singapore","Asia-Pacific (APAC), Association of Southeast Asian Nations (ASEAN), Southeast Asia",,,,,2018-11-09,,,,Corporate Round,,,,,Gobi Partners,1
BotDoc,https://www.crunchbase.com/organization/botdoc,Network Security,"Monument, Colorado, United States",Western US,2014-01-01,year,,,2018-09-01,,,,Seed,,,,Seed,SixThirty CYBER,1
Bitool,https://www.crunchbase.com/organization/bitool,Blockchain,"Beijing, Beijing, China",Asia-Pacific (APAC),2018-01-01,year,,,2018-07-30,879000,USD,879000,Angel,879000,USD,879000,Seed,Grand Venture Capital,1
Taraxa.io,https://www.crunchbase.com/organization/taraxa-io,"Blockchain, Internet of Things","San Jose, California, United States","San Francisco Bay Area, Silicon Valley, West Coast",2018-01-01,day,,,2018-07-10,,,,Venture - Series Unknown,,,,,MW Partners,1
VoPay International Inc.,https://www.crunchbase.com/organization/vopay,"Banking, Blockchain, Developer APIs, Financial Services, FinTech, Payments","Vancouver, British Columbia, Canada",,2015-01-01,day,,,2018-10-05,,,,Seed,,,,Seed,Plug and Play,1
BLOCKCLOUD,https://www.crunchbase.com/organization/blockcloud,"Bitcoin, Blockchain, Cryptocurrency, Information Technology, Internet","Shenzhen, Guangdong, China",Asia-Pacific (APAC),,,,,2018-07-16,,,,Venture - Series Unknown,,,,,"BlockVC, Consensus Lab, Elysium Venture Capital, Kosmos Capital, NEO Global Capital (NGC)",7
