DataDome,https://www.crunchbase.com/organization/datadome,"Analytics, Cyber Security, Internet, SaaS, Software","Paris, Ile-de-France, France",European Union (EU),2015-01-01,year,,,2018-01-31,2500000,EUR,3104294,Venture - Series Unknown,2500000,EUR,3104294,,"50 Partners, Francis Nappez, Isai, Quentin Nickmans, Wilco",15
Exclusive Group,https://www.crunchbase.com/organization/exclusive-group,"Computer, Information Technology, Network Security, Security","Boulogne, Nord-Pas-de-Calais, France",European Union (EU),1995-01-01,year,2018-04-13,day,2018-04-13,,,,Private Equity,,,,M&A,"Andera Partners, Omnes Capital, Permira",3
DFLabs,https://www.crunchbase.com/organization/dflabs,"Cyber Security, Network Security","Milano, Lombardia, Italy",European Union (EU),2004-10-01,day,,,2018-02-07,3500000,USD,3500000,Series A,3500000,USD,3500000,Early Stage Venture,Evolution Equity Partners,1
OriginTrail,https://www.crunchbase.com/organization/origintrail,"Blockchain, Information Services, Information Technology, Supply Chain Management","Ljubljana, Ljubljana Urban Commune, Slovenia",European Union (EU),2013-01-01,year,,,2018-01-15,22500000,USD,22500000,Initial Coin Offering,22500000,USD,22500000,,,
Tonic,https://www.crunchbase.com/organization/tonic-ai,"Developer Tools, Machine Learning, Privacy, SaaS","San Francisco, California, United States","San Francisco Bay Area, West Coast, Western US",2018-01-01,year,,,2018-06-01,1900000,USD,1900000,Seed,1900000,USD,1900000,Seed,"Bloomberg Beta, Heavybit, Xfund",3
Cyberinc,https://www.crunchbase.com/organization/cyberinc,"Cyber Security, Security, Service Industry","Los Gatos, California, United States","San Francisco Bay Area, Silicon Valley, West Coast",2016-01-01,year,2018-01-03,day,2018-05-10,5275000,USD,5275000,Series A,5275000,USD,5275000,M&A,"Benhamou Global Ventures, Javelin Venture Partners",2
Brickblock,https://www.crunchbase.com/organization/brickblock,"Blockchain, Financial Services, Real Estate, Smart Building","Gibraltar, Gibraltar, Gibraltar",,2017-01-01,year,,,2018-05-08,5000000,EUR,5933682,Series A,5000000,EUR,5933682,Early Stage Venture,Finch Capital,1
StreetCred,https://www.crunchbase.com/organization/streetcred,"Blockchain, Data Integration, Location Based Services, Mapping Services","New York, New York, United States","Greater New York Area, East Coast, Northeastern US",2018-03-01,month,,,2018-06-20,1000000,USD,1000000,Seed,1000000,USD,1000000,Seed,"Bowery Capital, Notation Capital",2
Altr,https://www.crunchbase.com/organization/altr-6b82,"Computer, Security, Software","Austin, Texas, United States",Southern US,2017-01-01,year,,,2018-06-07,15000000,USD,15000000,Venture - Series Unknown,15000000,USD,15000000,,John Stafford III,1
VideoCoin,https://www.crunchbase.com/organization/videocoin,"B2B, Blockchain, Cloud Infrastructure, Cloud Storage, Software, Video, Video Streaming","Grand Cayman, Midland, Cayman Islands",,2017-01-01,year,,,2018-03-16,50000000,USD,50000000,Initial Coin Offering,50000000,USD,50000000,,"Alphabit Fund, Anthony Di Iorio, Distributed Network Advisors, Randall Kaplan, Science Blockchain",7
BABB,https://www.crunchbase.com/organization/babb,"Banking, Blockchain, Finance, Financial Services, FinTech","London, England, United Kingdom",European Union (EU),2017-11-02,day,,,2018-06-01,1361930,GBP,1818440,Equity Crowdfunding,1361930,GBP,1818440,,Crowdcube,1
Jscrambler,https://www.crunchbase.com/organization/jscrambler,"Cyber Security, Security, Web Apps, Web Development","Porto, Lisboa, Portugal",European Union (EU),2014-01-01,day,,,2018-03-05,2300000,USD,2300000,Series A,2300000,USD,2300000,Early Stage Venture,"Portugal Ventures, Sonae IM",2
Dock,https://www.crunchbase.com/organization/dock-io,"Blockchain, Internet, Professional Networking","Burlingame, California, United States","San Francisco Bay Area, West Coast, Western US",2017-01-01,year,,,2018-02-21,20000000,USD,20000000,Initial Coin Offering,20000000,USD,20000000,,"BlockWater Management, Connect Capital, Liquid 2 Ventures",3
Cyberwrite,https://www.crunchbase.com/organization/cyberwrite,"Cyber Security, Insurance, Machine Learning","Tel Aviv, Tel Aviv, Israel",,2016-04-01,day,,,2018-05-08,,,,Seed,,,,Seed,"500 Startups, Plug and Play, Plug and Play Insurtech, QC·VENTURES, Speedinvest",5
Casa,https://www.crunchbase.com/organization/casa-8a1a,"Cryptocurrency, Financial Services, Security","New City, New York, United States","Greater New York Area, East Coast, Northeastern US",2016-01-01,year,,,2018-03-02,2100000,USD,2100000,Seed,2100000,USD,2100000,Seed,"Boost VC, Compound, Fabric Ventures, Lerer Hippeau",4
Protego Labs,https://www.crunchbase.com/organization/protego-labs,"Computer, Network Security","Baltimore, Maryland, United States","Greater Baltimore-Maryland Area, East Coast, Southern US",2017-01-01,year,,,2018-05-09,2000000,USD,2000000,Seed,2000000,USD,2000000,Seed,"Glilot Capital Partners, MetroSITE Group, Ron Gula, Tim Belcher",4
Cleeng,https://www.crunchbase.com/organization/cleeng,"Advertising, E-Commerce, Internet, SaaS, Security, Software, Video, Video on Demand","Amsterdam, Noord-Holland, The Netherlands",European Union (EU),2011-02-01,day,,,2018-06-26,5000000,EUR,5824763,Series B,5000000,EUR,5824763,Early Stage Venture,"C4 Ventures, Pascal Cagni, VOC Capital Partners, Walvis Participaties",4
Red Sift,https://www.crunchbase.com/organization/redsift,"Artificial Intelligence, Big Data, Cyber Security, Email, PaaS, SaaS","London, England, United Kingdom",European Union (EU),2015-06-01,month,,,2018-04-25,,,,Non-equity Assistance,2000000,USD,2000000,Seed,"Entrée Capital, Isomer Capital, Oxford Capital Partners, Pitch@Palace, White Star Capital",5
TAC Security,https://www.crunchbase.com/organization/tac-security-solutions,"Computer, Cyber Security","Chandigarh, Chandigarh, India",Asia-Pacific (APAC),2013-02-27,day,,,2018-01-20,500000,USD,500000,Venture - Series Unknown,500000,USD,500000,,"Subinder Khurana, Vijay Kedia",2
Dekrypt Capital,https://www.crunchbase.com/organization/dekrypt-capital,"Blockchain, Finance, Financial Services","Berkeley, California, United States","San Francisco Bay Area, West Coast, Western US",2017-01-01,year,,,2018-04-24,3000000,USD,3000000,Venture - Series Unknown,3000000,USD,3000000,,Reflective Venture Partners,1
DataRails,https://www.crunchbase.com/organization/datarails,"Analytics, Compliance, FinTech, Information Technology, SaaS, Software","Rishon Letsiyon, HaMerkaz, Israel",,2015-01-01,day,,,2018-06-01,3000000,USD,3000000,Series A,3000000,USD,3000000,Early Stage Venture,"Innovation Endeavors, Microsoft ScaleUp Tel Aviv, Oryzn Capital, Vertex Ventures, Vertex Ventures Israel",7
Nexkey,https://www.crunchbase.com/organization/nexkey-inc,"Cloud Computing, Hardware, Information Technology, Internet of Things, Mobile, Mobile Apps, SaaS, Security, Smart Building, Software","San Mateo, California, United States","San Francisco Bay Area, Silicon Valley, West Coast",2013-01-01,year,,,2018-04-30,4800000,USD,4800000,Seed,4800000,USD,4800000,Seed,"K9 Ventures, Upfront Ventures",2
Learning Machine Technologies,https://www.crunchbase.com/organization/learning-machine,"Blockchain, Education, Government, Human Resources, Identity Management, SaaS","New York, New York, United States","Greater New York Area, East Coast, Northeastern US",2017-01-01,year,,,2018-05-07,3000000,USD,3000000,Seed,3000000,USD,3000000,Seed,"Learn Capital, Omidyar Network, PTB Ventures",3
0chain,https://www.crunchbase.com/organization/0chain,"Big Data, Blockchain, Cloud Computing, Information Services, Information Technology","San Jose, California, United States","San Francisco Bay Area, Silicon Valley, West Coast",2017-07-01,month,,,2018-05-08,,,,Initial Coin Offering,,,,,"Arthur Iinuma, Block Ventures, G2H2 Capital",3
OB1,https://www.crunchbase.com/organization/ob1,"Bitcoin, Cryptocurrency, E-Commerce, Trading Platform","Centreville, Virginia, United States","Washington DC Metro Area, East Coast, Southern US",2015-04-24,day,,,2018-03-13,5000000,USD,5000000,Series A,5000000,USD,5000000,Early Stage Venture,"Andreessen Horowitz, Bitmain, Digital Currency Group, OMERS Ventures, Union Square Ventures",7
Cred,https://www.crunchbase.com/organization/libra-credit-network,"B2B, B2C, Big Data, Bitcoin, Financial Services","San Francisco, California, United States","San Francisco Bay Area, West Coast, Western US",2017-01-01,year,,,2018-04-26,16000000,USD,16000000,Initial Coin Offering,16000000,USD,16000000,,"500 Startups, BlockTower Capital, Boost VC, Dekrypt Capital, Zeroth.AI",14
Cryptopay,https://www.crunchbase.com/organization/cryptopay,"Bitcoin, Cryptocurrency, E-Commerce, Financial Services, FinTech, Payments, Trading Platform","London, England, United Kingdom",European Union (EU),2013-10-14,day,,,2018-01-25,,,,Venture - Series Unknown,,,,,"Seedcoin - Bitcoin Startup Incubator, Upscale",2
Baffin Bay Networks,https://www.crunchbase.com/organization/baffin-bay-networks,"Cyber Security, SaaS, Software","Stockholm, Stockholms Lan, Sweden","European Union (EU), Nordic Countries, Scandinavia",2017-02-15,day,,,2018-06-28,6400000,USD,6400000,Series A,6400000,USD,6400000,Early Stage Venture,EQT Ventures,1
Arviem,https://www.crunchbase.com/organization/arviem-ag,"Analytics, Internet of Things, Logistics, Security, Supply Chain Management","Baar, Zug, Switzerland",,2008-02-08,day,,,2018-04-05,10000000,USD,10000000,Series B,10000000,USD,10000000,Early Stage Venture,"investiere | Verve Capital Partners, SICPA, Swisscom, Swisscom Ventures, Zürcher Kantonal Bank",9
"Inspirit IoT, Inc",https://www.crunchbase.com/organization/inspirit-iot-inc,"Consumer, Health Care, Industrial, Information Technology, Internet of Things, Security, Smart Home","Champaign, Illinois, United States","Great Lakes, Midwestern US",2016-06-01,day,,,2018-06-19,2052923,USD,2052923,Seed,2052923,USD,2052923,Seed,"Senscape Technologies, Small Business Innovation Research",2
FCFL,https://www.crunchbase.com/organization/fcfl,"Blockchain, Cryptocurrency, Sports","Los Angeles, California, United States","Greater Los Angeles Area, West Coast, Western US",,,,,2018-01-04,5214285,USD,5214285,Initial Coin Offering,5214285,USD,5214285,,,
NXT-ID,https://www.crunchbase.com/organization/nxt-id,"Biometrics, Facial Recognition, Mobile, Mobile Apps, Security","Melbourne, Florida, United States","East Coast, Southern US",2011-01-01,year,2013-01-31,day,2018-05-29,16000000,USD,16000000,Post-IPO Debt,150000,USD,150000,IPO,"Connecticut Innovations, Sagard Holdings",2
Anjuna,https://www.crunchbase.com/organization/anjuna,"Computer, Network Security, Software","Palo Alto, California, United States","San Francisco Bay Area, Silicon Valley, West Coast",2017-01-01,year,,,2018-01-12,3000000,USD,3000000,Seed,3000000,USD,3000000,Seed,"Data Collective DCVC, Dorm Room Fund, Founder Collective, Playground Global, Y Combinator",7
Network Intelligence India Pvt. Ltd.,https://www.crunchbase.com/organization/network-intelligence-india-pvt-ltd,"Cyber Security, Security","Mumbai, Maharashtra, India",Asia-Pacific (APAC),2001-01-01,year,,,2018-06-15,330000000,INR,4840413,Private Equity,330000000,INR,4840413,Private Equity,Helix Investments,1
Percipient.ai,https://www.crunchbase.com/organization/percipient-ai,"Analytics, National Security, Security","Sunnyvale, California, United States","San Francisco Bay Area, Silicon Valley, West Coast",,,,,2018-03-13,14700000,USD,14700000,Series A,14700000,USD,14700000,Early Stage Venture,Venrock,1
Everspin,https://www.crunchbase.com/organization/everspin,"Cyber Security, Mobile Apps, Network Security","Seoul, Seoul-t'ukpyolsi, South Korea",Asia-Pacific (APAC),2014-02-28,day,,,2018-04-14,4262174,USD,4262174,Series B,4262174,USD,4262174,Early Stage Venture,"BlackPine, DSC Investment, Mirae Asset Global Investments, Mirae Asset Venture Investment, SBI Group",8
eloomi A/S,https://www.crunchbase.com/organization/eloomi,"Application Performance Management, Compliance, Corporate Training, E-Learning, Human Resources, SaaS","Copenhagen, Hovedstaden, Denmark","European Union (EU), Nordic Countries, Scandinavia",2015-04-01,day,,,2018-06-01,2000000,USD,2000000,Venture - Series Unknown,2000000,USD,2000000,,"PreSeed Ventures, Seed Capital, VF Venture",3
Eximchain,https://www.crunchbase.com/organization/eximchain,"Blockchain, Financial Services, Internet","Singapore, Central Region, Singapore","Asia-Pacific (APAC), Association of Southeast Asian Nations (ASEAN), Southeast Asia",2015-01-15,day,,,2018-03-16,20000000,USD,20000000,Initial Coin Offering,20000000,USD,20000000,,"Connect Capital, Cypher Capital, INBlockchain, Kinetic Capital, Lair East Labs",6
ClickIPO,https://www.crunchbase.com/organization/clickipo,"Financial Services, Retail, Security, Software","Scottsdale, Arizona, United States","Greater Phoenix Area, Western US",2011-01-01,year,,,2018-04-12,475001,USD,475001,Seed,475001,USD,475001,Seed,Jonathan Payne,1
Blockport,https://www.crunchbase.com/organization/blockport,"Blockchain, E-Commerce, Finance, Financial Exchanges, Financial Services, Internet, Payments","Amsterdam, Noord-Holland, The Netherlands",European Union (EU),2017-01-01,year,,,2018-01-24,13000000,EUR,16110543,Initial Coin Offering,13000000,EUR,16110543,,,
LGO Group,https://www.crunchbase.com/organization/lgo-group,"Blockchain, Cryptocurrency, Financial Exchanges, Financial Services, FinTech, Trading Platform","New York, New York, United States","Greater New York Area, East Coast, Northeastern US",2017-01-01,year,,,2018-02-01,30000000,USD,30000000,Initial Coin Offering,30000000,USD,30000000,,,
Saga Foundation,https://www.crunchbase.com/organization/saga-foundation,"Cryptocurrency, Software, Virtual Currency","Zug, Zug, Switzerland",,2017-01-01,year,,,2018-03-23,30000000,USD,30000000,Seed,30000000,USD,30000000,Seed,"Lightspeed Venture Partners, lool ventures, Mangrove Capital Partners, SPiCE VC",4
empow cyber security,https://www.crunchbase.com/organization/empow-cyber-security,"Cyber Security, Information Technology, Security","Boston, Massachusetts, United States","Greater Boston Area, East Coast, New England",2014-01-01,year,,,2018-04-18,10000000,USD,10000000,Series B,10000000,USD,10000000,Early Stage Venture,Ascent Venture Partners,1
Yellow,https://www.crunchbase.com/organization/yellow,"Bitcoin, Internet, Software",,,2014-02-01,month,,,2018-04-04,9000000,USD,9000000,Seed,9000000,USD,9000000,Seed,"Digital Currency Group, Grishin Robotics",2
OwlTing,https://www.crunchbase.com/organization/owlting,"Blockchain, E-Commerce, Mobile, SaaS, Travel","Taipei, T'ai-pei, Taiwan",Asia-Pacific (APAC),2010-09-01,day,,,2018-05-11,,,,Corporate Round,,,,,"Midana Capital, SBI Investment",2
Blocko,https://www.crunchbase.com/organization/blocko,"Blockchain, Enterprise Software, Internet of Things, Software","Pangyo, Kyonggi-do, South Korea",Asia-Pacific (APAC),2014-12-01,day,,,2018-06-11,8900000,USD,8900000,Series B,8900000,USD,8900000,Early Stage Venture,"InterVest Co., Premier Partners, Samsung Ventures, SparkLabs Accelerator, SparkLabs Ventures",8
AID:Tech,https://www.crunchbase.com/organization/aid-tech,"Artificial Intelligence, Blockchain, Enterprise Software, GovTech, Information Technology, Social Assistance, Social Impact, Software","Dublin, Dublin, Ireland",European Union (EU),2016-05-16,day,,,2018-06-13,1000000,EUR,1180350,Seed,1000000,EUR,1180350,Seed,"Enterprise Ireland, LAUNCH, MassChallenge, SGInnovate, Techstars",12
Netki,https://www.crunchbase.com/organization/netki-inc,"Computer, FinTech, Privacy, Security","Canoga Park, California, United States","Greater Los Angeles Area, West Coast, Western US",2014-07-14,day,,,2018-05-03,,,,Convertible Note,3500000,USD,3500000,Seed,"Base Ventures, Bitfinex, Digital Currency Group, Donuts, Plug and Play",11
Loopring,https://www.crunchbase.com/organization/loopring,"Blockchain, Cryptocurrency, Ethereum","Shanghai, Shanghai, China",Asia-Pacific (APAC),2017-08-01,day,2018-05-05,day,2018-02-05,,,,Initial Coin Offering,,,,M&A,"G2H2 Capital, NEO, Obsidian Capital",3
QuintessenceLabs,https://www.crunchbase.com/organization/quintessencelabs,"Computer, Cyber Security, Network Security, Quantum Computing","Canberra, Australian Capital Territory, Australia","Asia-Pacific (APAC), Australasia",2006-01-01,year,,,2018-01-24,528000,AUD,425054,Grant,7473410,AUD,5866241,Early Stage Venture,,
Mycelium,https://www.crunchbase.com/organization/mycelium,"Blockchain, Cryptocurrency, Financial Services, FinTech","London, England, United Kingdom",European Union (EU),2012-01-01,year,,,2018-01-03,5000000,USD,5000000,Series A,5000000,USD,5000000,Early Stage Venture,,
Zentera Systems,https://www.crunchbase.com/organization/zentera-systems,"Cloud Computing, Cloud Infrastructure, Cloud Security, Cyber Security, Enterprise, Network Security","San Jose, California, United States","San Francisco Bay Area, Silicon Valley, West Coast",2012-01-01,year,,,2018-06-12,5000000,USD,5000000,Venture - Series Unknown,5000000,USD,5000000,,China Development Industrial Bank (CDIB),1
Hub,https://www.crunchbase.com/organization/hub-4,"Blockchain, Business Development, Business Information Systems, Communities, Computer, Local Business","Mountain View, California, United States","San Francisco Bay Area, Silicon Valley, West Coast",2016-06-01,day,,,2018-06-02,20000000,USD,20000000,Initial Coin Offering,20000000,USD,20000000,,"Data Collective DCVC, Legend Capital, Sway Ventures, Ulu Ventures, UP2398",14
Decision Sciences,https://www.crunchbase.com/organization/decision-sciences,"Enterprise Software, Hardware, Security","Chantilly, Virginia, United States","Washington DC Metro Area, East Coast, Southern US",2001-01-01,year,,,2018-05-11,10000000,USD,10000000,Venture - Series Unknown,10000000,USD,10000000,,,
TaTaTu Enterprises,https://www.crunchbase.com/organization/tatatu-enterprises,"Blockchain, Video, Video Streaming","London, England, United Kingdom",European Union (EU),,,,,2018-06-24,575000000,USD,575000000,Initial Coin Offering,575000000,USD,575000000,,,
Cyabra,https://www.crunchbase.com/organization/cyabra,"Cyber Security, Information Services, Natural Language Processing, SaaS, Social Media","Tel Aviv, Tel Aviv, Israel",,2017-08-01,month,,,2018-06-27,1000000,USD,1000000,Seed,1000000,USD,1000000,Seed,TAU Ventures,1
Spherical Defence Labs,https://www.crunchbase.com/organization/spherical-defence-labs,"Artificial Intelligence, Cyber Security, E-Commerce, Security","Walnut, California, United States","Greater Los Angeles Area, West Coast, Western US",2015-07-24,day,,,2018-01-31,2000000,USD,2000000,Seed,2000000,USD,2000000,Seed,"Conversion Capital, CyLon, Michael Pennington, NCSC Cyber Accelerator, Point72 Ventures",6
APERIO Systems,https://www.crunchbase.com/organization/aperio-systems,"Cyber Security, Infrastructure, Real Time, Software","Haifa, Hefa, Israel",,2016-01-01,day,,,2018-02-07,4500000,USD,4500000,Seed,4500000,USD,4500000,Seed,"Data Point Capital, EDP, Jump Capital, Scopus Ventures",4
CounterCraft,https://www.crunchbase.com/organization/countercraft,"Cyber Security, Network Security, Security","San Sebastian, Pais Vasco, Spain",European Union (EU),2015-09-01,day,,,2018-03-21,2000000,EUR,2469324,Seed,2000000,EUR,2469324,Seed,"Adara Ventures, EASME - EU Executive Agency for SMEs, Evolution Equity Partners, NCSC Cyber Accelerator, Wayra",7
DataVisor,https://www.crunchbase.com/organization/datavisor,"Analytics, Artificial Intelligence, Big Data, Cyber Security, Fraud Detection, Internet, Machine Learning, Security, Software","Mountain View, California, United States","San Francisco Bay Area, Silicon Valley, West Coast",2013-12-20,day,,,2018-02-09,40000000,USD,40000000,Series C,40000000,USD,40000000,Late Stage Venture,"Genesis Capital, GSR Ventures, New Enterprise Associates, Sequoia Capital China",4
FUSION Foundation,https://www.crunchbase.com/organization/fusion-foundation,"Blockchain, Information Services, Information Technology, Internet","Singapore, Central Region, Singapore","Asia-Pacific (APAC), Association of Southeast Asian Nations (ASEAN), Southeast Asia",,,,,2018-02-14,110000000,USD,110000000,Initial Coin Offering,110000000,USD,110000000,,BlockWater Management,1
Lendingblock,https://www.crunchbase.com/organization/lendingblock,"Blockchain, Cryptocurrency, Lending","London, England, United Kingdom",European Union (EU),2017-10-01,month,,,2018-04-18,10000000,USD,10000000,Initial Coin Offering,10000000,USD,10000000,,,
Globacap,https://www.crunchbase.com/organization/globacap,"Blockchain, Financial Services, FinTech","London, England, United Kingdom",European Union (EU),2017-11-03,day,,,2018-06-06,800000,USD,800000,Seed,800000,USD,800000,Seed,"Christian Schulte, Stephen Russell, Stoic Capital",3
imToken,https://www.crunchbase.com/organization/imtoken,"Asset Management, Ethereum, Information Technology, Software","Hangzhou, Zhejiang, China",Asia-Pacific (APAC),2016-05-01,month,,,2018-05-31,10000000,USD,10000000,Series A,10000000,USD,10000000,Early Stage Venture,IDG Capital,1
Nextmarkets,https://www.crunchbase.com/organization/nextmarkets-gmbh,"Blockchain, Financial Services, Stock Exchanges, Trading Platform","Cologne, Nordrhein-Westfalen, Germany",European Union (EU),2014-01-01,year,,,2018-06-14,6000000,EUR,6938341,Series A,6000000,EUR,6938341,Early Stage Venture,"Axel Springer, Cryptology Asset Group, EXTOREL, FinLab, Founders Fund",6
Allure Security Technology,https://www.crunchbase.com/organization/allure-security-technology-inc,"Analytics, Artificial Intelligence, Big Data, Cloud Security, Cyber Security, Machine Learning, Mobile, Risk Management","Waltham, Massachusetts, United States","Greater Boston Area, East Coast, New England",2009-01-01,year,,,2018-01-25,5300000,USD,5300000,Seed,5300000,USD,5300000,Seed,"Glasswing Ventures, Greycroft, Portage Partners, Zetta Venture Partners",4
FintruX Network,https://www.crunchbase.com/organization/fintrux,"B2B, Blockchain, Financial Services, FinTech","Singapore, Central Region, Singapore","Asia-Pacific (APAC), Association of Southeast Asian Nations (ASEAN), Southeast Asia",2017-01-01,year,,,2018-03-26,25000000,USD,25000000,Initial Coin Offering,25000000,USD,25000000,,,
AIAR EdTech AB,https://www.crunchbase.com/organization/aiar-edtech-ab,"Artificial Intelligence, Augmented Reality, Blockchain, Digital Marketing, E-Learning, EdTech, Education, Sales, Training","Stockholm, Stockholms Lan, Sweden","European Union (EU), Nordic Countries, Scandinavia",2017-01-01,year,,,2018-03-09,4643380,SEK,562926,Series A,4643380,SEK,562926,Early Stage Venture,Milky Way Cap,1
Kela Group,https://www.crunchbase.com/organization/kela-group,"Analytics, Artificial Intelligence, Business Intelligence, Computer, Cyber Security, Information Technology, Network Security","Tel Aviv, Tel Aviv, Israel",,2009-01-01,year,,,2018-05-16,50000000,USD,50000000,Private Equity,50000000,USD,50000000,Private Equity,Vector Capital,1
Unchained Capital,https://www.crunchbase.com/organization/unchained-capital,"Bitcoin, Cryptocurrency, Ethereum, Financial Services, FinTech","Austin, Texas, United States",Southern US,2017-01-01,year,,,2018-06-06,3000000,USD,3000000,Seed,3000000,USD,3000000,Seed,"Brian Spaly, Ecliptic Capital, Ezra Galston, Michael Komaransky, Starting Line",5
Minim,https://www.crunchbase.com/organization/minim,"Cyber Security, Internet of Things, Network Security, Security","Manchester, New Hampshire, United States","East Coast, New England, Northeastern US",2017-01-01,year,,,2018-04-30,2500000,USD,2500000,Seed,2500000,USD,2500000,Seed,"Company Ventures, Flybridge Capital Partners, Founder Collective",3
Kyckr Limited,https://www.crunchbase.com/organization/kyckr,"Compliance, FinTech, Legal","Waterford, Waterford, Ireland",European Union (EU),2007-04-08,day,2016-09-08,day,2018-06-01,5000000,AUD,3784541,Post-IPO Equity,5000000,AUD,3784541,IPO,,
UpCodes,https://www.crunchbase.com/organization/upcodes,"Architecture, Civil Engineering, Compliance, Construction","San Francisco, California, United States","San Francisco Bay Area, West Coast, Western US",2016-02-08,day,,,2018-06-11,665000,USD,665000,Seed,665000,USD,665000,Seed,"Bragiel Brothers, Foundation Capital, Kevin Moore, Liquid 2 Ventures, Y Combinator",8
ZenMate,https://www.crunchbase.com/organization/zenguard,"Browser Extensions, Privacy, Security, Software","Berlin, Berlin, Germany",European Union (EU),2013-01-01,year,2018-10-16,day,2018-06-13,23040,GBP,30832,Equity Crowdfunding,23040,GBP,30832,M&A,"Axel Springer Plug and Play Accelerator, Bessemer Venture Partners, Deutsche Telekom Strategic Investments, HV Holtzbrinck Ventures, Project A",7
Quantum Xchange,https://www.crunchbase.com/organization/quantum-xchange,"Computer, Cyber Security, Information Technology","Bethesda, Maryland, United States","Washington DC Metro Area, East Coast, Southern US",2018-01-01,year,,,2018-06-26,10000000,USD,10000000,Series A,10000000,USD,10000000,Early Stage Venture,New Technology Ventures,1
Threatcare,https://www.crunchbase.com/organization/threatcare,"Cyber Security, Information Technology, Network Security, SaaS","Austin, Texas, United States",Southern US,2014-01-01,year,,,2018-01-04,1400000,USD,1400000,Seed,1400000,USD,1400000,Seed,"Firebrand Ventures, Flyover Capital, Moonshots Capital, Right Side Capital Management, Techstars",9
AdHive,https://www.crunchbase.com/organization/adhive,"Advertising Platforms, Artificial Intelligence, Blockchain, Brand Marketing, Digital Marketing, Marketing, Marketing Automation, Social Media Advertising","Tallinn, Harjumaa, Estonia",European Union (EU),2017-11-02,day,,,2018-03-24,17500000,USD,17500000,Initial Coin Offering,17500000,USD,17500000,,,
Rapidly,https://www.crunchbase.com/organization/rapidly,"Compliance, Finance, Financial Services, FinTech, Information Technology, Marketplace","San Francisco, California, United States","San Francisco Bay Area, West Coast, Western US",2017-02-27,day,,,2018-05-24,150000,USD,150000,Convertible Note,300000,USD,300000,Seed,,
