Ternio,https://www.crunchbase.com/organization/ternio,"Advertising Platforms, Blockchain, Credit Cards","New York, New York, United States","Greater New York Area, East Coast, Northeastern US",2017-12-01,month,,,2018-09-19,10000000,USD,10000000,Series A,10000000,USD,10000000,Early Stage Venture,,
Bison Trails,https://www.crunchbase.com/organization/bison-trails,"Blockchain, Infrastructure, Internet, Software","Brooklyn, New York, United States","Greater New York Area, East Coast, Northeastern US",2018-10-01,month,,,2018-11-30,5250000,USD,5250000,Seed,5250000,USD,5250000,Seed,"Accomplice, Distributed Global, Homebrew, Initialized Capital, Notation Capital",8
Venminder,https://www.crunchbase.com/organization/venminder,"B2B, Compliance, Financial Services, FinTech, Professional Services, Risk Management, Software","Elizabethtown, Kentucky, United States",Southern US,2003-01-01,year,,,2018-07-18,5000000,USD,5000000,Series B,5000000,USD,5000000,Early Stage Venture,"Bain Capital, Bain Capital Ventures, MissionOG",3
clearmatics,https://www.crunchbase.com/organization/clearmatics,"Blockchain, Ethereum, FinTech, Information Technology, Software Engineering","London, England, United Kingdom",European Union (EU),2015-02-06,day,,,2018-10-10,12000000,USD,12000000,Series A,12000000,USD,12000000,Early Stage Venture,"Nyca Partners, Route 66 Ventures, TNF Capital, XTX Markets",4
SayVU,https://www.crunchbase.com/organization/sayvu,"Homeland Security, Law Enforcement, Public Safety, Security, Software","Ramat Gan, Tel Aviv, Israel",,2015-11-09,day,,,2018-07-01,500000,USD,500000,Convertible Note,400000,USD,400000,,BIRD Foundation,1
Kucoin,https://www.crunchbase.com/organization/kucoin,"Bitcoin, Blockchain, Cryptocurrency, Finance, Financial Exchanges","Singapore, Central Region, Singapore","Asia-Pacific (APAC), Association of Southeast Asian Nations (ASEAN), Southeast Asia",2013-01-01,year,,,2018-11-15,20000000,USD,20000000,Series A,20000000,USD,20000000,Early Stage Venture,"IDG Capital, Matrix Partners, NEO Global Capital (NGC)",3
Bitwala,https://www.crunchbase.com/organization/bitwala,"Blockchain, Cryptocurrency, Financial Services, FinTech","Berlin, Berlin, Germany",European Union (EU),2015-10-01,month,,,2019-01-01,71429,EUR,81868,Grant,4000000,EUR,4705328,,"coparion, Digital Currency Group, Earlybird Venture Capital, EASME - EU Executive Agency for SMEs, High-Tech Gründerfonds",6
Seba Crypto,https://www.crunchbase.com/organization/seba-crypto,"Blockchain, Cryptocurrency, Finance, Financial Services","Zug, Zug, Switzerland",,2018-01-01,year,,,2018-09-27,104000000,USD,104000000,Venture - Series Unknown,104000000,USD,104000000,,Black River Asset Management,1
"Eagle Eye Networks, Inc.",https://www.crunchbase.com/organization/eagle-eye-networks,"Cloud Computing, Cyber Security, Internet, Physical Security, SaaS, Security, Video","Austin, Texas, United States",Southern US,2012-01-01,year,,,2018-11-05,25000000,USD,25000000,Series C,25000000,USD,25000000,Late Stage Venture,"Austin Ventures, MSD Capital",2
Coinfirm,https://www.crunchbase.com/organization/coinfirm,"Bitcoin, Blockchain, Compliance, Financial Services, FinTech","London, England, United Kingdom",European Union (EU),2016-01-01,year,,,2018-09-06,,,,Venture - Series Unknown,,,,,Tech Nation Fintech,1
Cloud Conformity,https://www.crunchbase.com/organization/cloud-conformity,Cloud Security,"Pyrmont, New South Wales, Australia","Asia-Pacific (APAC), Australasia",2016-01-01,day,,,2018-08-01,2800000,USD,2800000,Series A,2800000,USD,2800000,Early Stage Venture,"Jump Capital, Paladin Capital Group",2
Elixxir,https://www.crunchbase.com/organization/elixxir-io,"Blockchain, Developer Platform, Messaging, Payments","Los Angeles, California, United States","Greater Los Angeles Area, West Coast, Western US",2017-01-01,year,,,2018-10-24,8500000,USD,8500000,Seed,8500000,USD,8500000,Seed,Chris Larsen,1
globaliD,https://www.crunchbase.com/organization/global-id,"Blockchain, Consumer Lending, Identity Management, Mobile Apps, Security","San Francisco, California, United States","San Francisco Bay Area, West Coast, Western US",2016-01-01,year,,,2018-07-09,6000000,USD,6000000,Series A,6000000,USD,6000000,Early Stage Venture,"500 Startups, Arbor Ventures, Camp One Ventures, Hard Yaka, Monex Ventures",6
Digital Risks,https://www.crunchbase.com/organization/digital-risks,"Commercial Insurance, Cyber Security, FinTech, Insurance, InsurTech","London, England, United Kingdom",European Union (EU),2015-01-01,year,,,2018-07-16,2250000,GBP,2978207,Seed,2250000,GBP,2978207,Seed,"Atami Capital, Aviva Ventures, Concentric, London Co-Investment Fund, Seedcamp",8
CUJO AI,https://www.crunchbase.com/organization/cujo,"Artificial Intelligence, Big Data, Cyber Security, Internet of Things, Network Security, Smart Home, Software","Mountain View, California, United States","San Francisco Bay Area, Silicon Valley, West Coast",2015-01-01,year,,,2018-10-19,,,,Series B,,,,Early Stage Venture,"Charter Communications, KPN Ventures, TA Ventures",3
Neufund,https://www.crunchbase.com/organization/neufund,"Bitcoin, Blockchain, Cryptocurrency, Financial Services, Payments","Berlin, Berlin, Germany",European Union (EU),2016-09-01,day,,,2018-12-11,3000000,EUR,3397050,Initial Coin Offering,3000000,EUR,3397050,,"Atlantic Labs, Freigeist Capital, Klaas Kersting, Max Kordek, Michael Jackson",8
Hey,https://www.crunchbase.com/organization/hey-859f,"Blockchain, Cryptocurrency, Social Media, Social Network","Brussels, Brussels Hoofdstedelijk Gewest, Belgium",European Union (EU),2018-06-06,day,,,2018-10-10,700000,EUR,807321,Seed,700000,EUR,807321,Seed,,
CoinCasso,https://www.crunchbase.com/organization/coincasso,"Bitcoin, Cryptocurrency, Ethereum, Finance, Financial Exchanges, Financial Services, FinTech, Internet, Stock Exchanges, Virtual Currency","Tallinn, Harjumaa, Estonia",European Union (EU),2018-05-17,day,,,2018-11-02,3500000,USD,3500000,Initial Coin Offering,3500000,USD,3500000,,,
TradeBlock,https://www.crunchbase.com/organization/tradeblock,"Bitcoin, Cryptocurrency, Financial Services, FinTech","New York, New York, United States","Greater New York Area, East Coast, Northeastern US",2013-01-01,year,,,2018-08-16,32661508,USD,32661508,Venture - Series Unknown,32661508,USD,32661508,,"Andreessen Horowitz, Data Collective DCVC, F-Prime Capital, Hard Yaka, Y Combinator",8
Cylera,https://www.crunchbase.com/organization/cylera,"Cyber Security, Health Care","New York, New York, United States","Greater New York Area, East Coast, Northeastern US",2017-01-01,year,,,2018-09-04,4250000,USD,4250000,Seed,4250000,USD,4250000,Seed,"Dreamit Ventures, Great Oaks Venture Capital, Maverick Ventures, Samsung NEXT, Two Sigma Ventures",7
Audius,https://www.crunchbase.com/organization/audius,"Blockchain, Digital Entertainment, Music","San Francisco, California, United States","San Francisco Bay Area, West Coast, Western US",2018-02-01,month,,,2018-08-08,5500000,USD,5500000,Series A,5500000,USD,5500000,Early Stage Venture,"122WEST VENTURES, General Catalyst, Kleiner Perkins, Lightspeed Venture Partners, Pantera Capital",6
Lakeba Group Pty Ltd,https://www.crunchbase.com/organization/lakeba-corporation,"Artificial Intelligence, Blockchain, Financial Services, Information Technology, Internet of Things, Security, Software","Sydney, New South Wales, Australia","Asia-Pacific (APAC), Australasia",2013-08-01,month,,,2018-12-01,10000000,AUD,7313999,Series A,10000000,AUD,7313999,Early Stage Venture,,
WISeKey,https://www.crunchbase.com/organization/wisekey,"Cyber Security, Identity Management, Network Security, SaaS, Security","Geneva, Geneve, Switzerland",,1999-01-01,year,2016-04-08,day,2018-10-01,3500000,USD,3500000,Post-IPO Debt,50000000,CHF,53220647,IPO,"32 Ventures, Global Equity Partners Beteiligungs-Management, GVA Capital, Saudi Crown Holding, The Global Emerging Markets Group",6
Tresorit,https://www.crunchbase.com/organization/tresorium,"Cloud Security, Collaboration, Information Technology, Security, Software","Zürich, Zurich, Switzerland",,2011-01-01,year,,,2018-12-21,11500000,EUR,13076072,Series B,11500000,EUR,13076072,Early Stage Venture,"3TS Capital Partners, Day One Capital, Euroventures Capital Advisory, Marton Szoke, PortfoLion",8
Convergint Technologies,https://www.crunchbase.com/organization/convergint-technologies,"Biometrics, Health Care, Security, Video","Sharon, Massachusetts, United States","Greater Boston Area, East Coast, New England",2001-01-01,year,2018-02-02,day,2018-08-27,19744898,USD,19744898,Venture - Series Unknown,19744898,USD,19744898,M&A,,
ButterflyMX,https://www.crunchbase.com/organization/butterflymx,"Internet, Real Estate, Security, Software","New York, New York, United States","Greater New York Area, East Coast, Northeastern US",2012-03-23,day,,,2018-08-16,5500000,USD,5500000,Series A,5500000,USD,5500000,Early Stage Venture,,
Cobo,https://www.crunchbase.com/organization/cobo,"Blockchain, Cryptocurrency, FinTech","Beijing, Beijing, China",Asia-Pacific (APAC),2017-11-01,month,,,2018-10-17,13000000,USD,13000000,Series A,13000000,USD,13000000,Early Stage Venture,"DHVC, FREES FUND, IMO Ventures, Linear Venture, Wu Capital",5
Syndio Solutions,https://www.crunchbase.com/organization/syndio,"Analytics, Compliance, Human Resources, Legal, Machine Learning, Predictive Analytics, SaaS, Social Network","Seattle, Washington, United States","Greater Seattle Area, West Coast, Western US",2016-11-01,month,,,2018-11-14,5200000,USD,5200000,Seed,5200000,USD,5200000,Seed,"Contour Venture Partners, Frontier Venture Capital, Garry Mathiason, Robert Millman, Sirius Venture Partners",5
Gospel Technology,https://www.crunchbase.com/organization/gospel-technology,"Cyber Security, Software","London, England, United Kingdom",European Union (EU),2016-01-01,year,,,2018-11-07,,,,Non-equity Assistance,5000000,GBP,6558047,Early Stage Venture,"IA Ventures, LocalGlobe, Michael Pennington, Pitch@Palace, Salesforce Ventures",6
"MindTop, Inc.",https://www.crunchbase.com/organization/benu-networks,"Analytics, Cloud Infrastructure, Cloud Management, Cloud Security, Hardware, Infrastructure, Internet, Internet of Things, Mobile, Network Hardware, Network Security, Software, Telecommunications, Wireless","Billerica, Massachusetts, United States","Greater Boston Area, East Coast, New England",2010-01-01,year,,,2018-07-19,10000000,USD,10000000,Venture - Series Unknown,10000000,USD,10000000,,"Arris Group, Comcast Ventures, Liberty Global Ventures, Spark Capital, Sutter Hill Ventures",8
Corsa Technology,https://www.crunchbase.com/organization/corsa-technology,"Cloud Security, Network Security, Security","Ottawa, Ontario, Canada",Great Lakes,2011-01-01,year,,,2018-07-25,9000000,USD,9000000,Series C,9000000,USD,9000000,Late Stage Venture,"BDC Capital Corporation, BDC Venture Capital, Celtic House Venture Partners, Roadmap Capital",4
WhiteFox Defense Technologies,https://www.crunchbase.com/organization/whitefox-defense-technologies-inc,"Artificial Intelligence, Drone Management, Drones, Mobile, Security","San Luis Obispo, California, United States","West Coast, Western US",2015-12-14,day,,,2018-12-06,12000000,USD,12000000,Seed,12000000,USD,12000000,Seed,"Frontier Venture Capital, OCA Ventures, Okapi Venture Capital, Serra Ventures, Stage Venture Partners",9
Nervos Network,https://www.crunchbase.com/organization/nervos,"Blockchain, Information Services, Information Technology","Hangzhou, Zhejiang, China",Asia-Pacific (APAC),2018-01-01,month,,,2018-07-18,28000000,USD,28000000,Series A,28000000,USD,28000000,Early Stage Venture,"500 Startups, Blockchain Capital, Matrix Partners China, Multicoin Capital, Polychain",21
Trustology,https://www.crunchbase.com/organization/trustology,"Blockchain, Cryptocurrency, FinTech, Information Technology, Virtual Currency","London, England, United Kingdom",European Union (EU),2017-11-07,day,,,2018-12-06,8000000,USD,8000000,Seed,8000000,USD,8000000,Seed,"ConsenSys, Two Sigma Ventures",2
SKALE Labs,https://www.crunchbase.com/organization/skale-labs,"Blockchain, FinTech, Information Technology, Internet, Internet of Things","San Francisco, California, United States","San Francisco Bay Area, West Coast, Western US",2018-01-01,day,,,2018-10-04,8860000,USD,8860000,Venture - Series Unknown,8860000,USD,8860000,,"Aspect Ventures, Canaan Partners, FLOODGATE, Galaxy Digital LP, Multicoin Capital",12
XAIN,https://www.crunchbase.com/organization/xain-group,"Artificial Intelligence, Cyber Security, Machine Learning, SaaS","Berlin, Berlin, Germany",European Union (EU),2017-01-01,year,,,2018-07-30,,,,Initial Coin Offering,,,,,"Connect Capital, Earlybird Venture Capital",2
Cherry Home,https://www.crunchbase.com/organization/cherry-labs,"Artificial Intelligence, Security, Smart Home","Palo Alto, California, United States","San Francisco Bay Area, Silicon Valley, West Coast",2016-11-01,day,,,2018-12-20,5200000,USD,5200000,Series A,5200000,USD,5200000,Early Stage Venture,"Gagarin Capital Partners, Greg Silverman, GSR Ventures, GVA Capital, Impulse VC",10
HYAS InfoSec,https://www.crunchbase.com/organization/hyas-infosec,"Cyber Security, Network Security, Security","Victoria, British Columbia, Canada",,2015-06-01,day,,,2018-11-28,2000000,USD,2000000,Debt Financing,6700000,USD,6700000,Early Stage Venture,"205 Capital, M12, Silicon Valley Bank, Startup Capital Ventures, Susa Ventures",10
Solink,https://www.crunchbase.com/organization/solink,"Analytics, Big Data, Business Intelligence, Retail, Security","Ottawa, Ontario, Canada",Great Lakes,2009-01-01,year,,,2018-11-26,16300000,CAD,12297942,Series A,16300000,CAD,12297942,Early Stage Venture,"BDC Venture Capital, Hedgewood, ScaleUP Ventures, Tom Williams, Valor Equity Partners",8
PolySign,https://www.crunchbase.com/organization/polysign,Security,"Oakland, California, United States","San Francisco Bay Area, West Coast, Western US",2017-09-01,day,,,2018-12-04,8204000,USD,8204000,Venture - Series Unknown,8204000,USD,8204000,,"CRCM Ventures, Kilowatt Capital LLC",2
Siilo,https://www.crunchbase.com/organization/siilo,"Collaboration, Compliance, Enterprise, Health Care, Messaging, Privacy, Real Time, Social Media","Amsterdam, Noord-Holland, The Netherlands",European Union (EU),2016-01-01,day,,,2018-10-04,4500000,EUR,5182671,Seed,4500000,EUR,5182671,Seed,EQT Ventures,1
Uniken,https://www.crunchbase.com/organization/uniken,"Cyber Security, Embedded Systems, Security","Chatham, New Jersey, United States","Greater New York Area, East Coast, Northeastern US",2013-08-01,month,,,2018-11-08,10000000,USD,10000000,Venture - Series Unknown,10000000,USD,10000000,,,
AnChain.ai,https://www.crunchbase.com/organization/anchain-ai,"Artificial Intelligence, Big Data, Bitcoin, Blockchain, Cryptocurrency, Cyber Security, Ethereum, FinTech, Machine Learning, Risk Management","San Jose, California, United States","San Francisco Bay Area, Silicon Valley, West Coast",2018-07-01,month,,,2018-08-01,2000000,USD,2000000,Seed,2000000,USD,2000000,Seed,"Amino Capital, CRCM Ventures, Susquehanna International Group (SIG)",3
Myki,https://www.crunchbase.com/organization/ki,"Enterprise, Identity Management, Mobile, Security","New York, New York, United States","Greater New York Area, East Coast, Northeastern US",2015-10-18,day,,,2018-09-05,4000000,USD,4000000,Series A,4000000,USD,4000000,Early Stage Venture,"B&Y Venture Partners, BECO Capital, Leap Ventures",3
Trustify,https://www.crunchbase.com/organization/trustify,"Apps, Business Intelligence, Fraud Detection, Identity Management, Law Enforcement, Marketplace, Privacy, Security","Arlington, Virginia, United States","Washington DC Metro Area, East Coast, Southern US",2015-04-01,day,,,2018-08-23,2986077,USD,2986077,Venture - Series Unknown,2986077,USD,2986077,,"500 Startups, Carthona Capital, Lowercase Capital, Plum Alley, SeedInvest",10
Fuel Games,https://www.crunchbase.com/organization/fuel-games,"Blockchain, PC Games, Video Games","Sydney, New South Wales, Australia","Asia-Pacific (APAC), Australasia",2018-01-01,year,,,2018-07-09,2400000,USD,2400000,Seed,2400000,USD,2400000,Seed,"Coinbase, Continue Capital, Nirvana Capital, Sora Ventures",4
Qtum,https://www.crunchbase.com/organization/qtum,"Blockchain, Cryptocurrency, Ethereum","Singapore, Central Region, Singapore","Asia-Pacific (APAC), Association of Southeast Asian Nations (ASEAN), Southeast Asia",2016-01-01,year,,,2018-12-19,400000,USD,400000,Grant,15600000,USD,15600000,,"Distributed Global, Hashed, James Sowers, Nirvana Capital, Tally Capital",12
Minds,https://www.crunchbase.com/organization/minds,"Blockchain, Blogging Platforms, Cryptocurrency, Ethereum, Peer to Peer, Photography, Social Network, Social News, Video, Video Chat","Wilton, Connecticut, United States","East Coast, New England, Northeastern US",2011-02-11,day,,,2018-10-22,6000000,USD,6000000,Series A,6000000,USD,6000000,Early Stage Venture,Medici Ventures,1
Braintrust,https://www.crunchbase.com/organization/braintrust-bac9,"Blockchain, Human Resources, Information Technology, Internet, Software","San Francisco, California, United States","San Francisco Bay Area, West Coast, Western US",2018-05-22,day,,,2018-12-11,5000000,USD,5000000,Seed,5000000,USD,5000000,Seed,True Ventures,1
Abacus,https://www.crunchbase.com/organization/abacusfi,"Blockchain, Finance, Financial Services, FinTech","San Francisco, California, United States","San Francisco Bay Area, West Coast, Western US",2018-06-05,day,,,2018-12-17,2000000,USD,2000000,Seed,2000000,USD,2000000,Seed,"Coinbase, Cypher Capital, Justin Kan, Y Combinator, Yeoman’s Growth Capital",5
MyCrypto,https://www.crunchbase.com/organization/mycrypto,"Cryptocurrency, Financial Services, Information Services, Information Technology","Redondo Beach, California, United States","Greater Los Angeles Area, West Coast, Western US",2017-01-01,year,,,2018-08-30,4000000,USD,4000000,Series A,4000000,USD,4000000,Early Stage Venture,"Ausum Ventures, Boost VC, Lily Liu, Polychain, ShapeShift",8
MYPINPAD,https://www.crunchbase.com/organization/mypinpad,"Identity Management, Information Technology, Security","London, England, United Kingdom",European Union (EU),2012-08-01,day,,,2018-10-23,20000000,USD,20000000,Series B,20000000,USD,20000000,Early Stage Venture,"Asia Principal Capital, Level39, Raven Ventures Australia",3
AERGO,https://www.crunchbase.com/organization/aergo-e080,"Blockchain, Cryptocurrency, Information Technology","Wan Chai, Hong Kong Island, Hong Kong",Asia-Pacific (APAC),2018-01-01,year,,,2018-11-16,30000000,USD,30000000,Venture - Series Unknown,30000000,USD,30000000,,"Dekrypt Capital, JLAB | JD capital, JRR Crypto, NEO Global Capital (NGC), Sequoia Capital China",10
AbiliSense,https://www.crunchbase.com/organization/abilisense,"Artificial Intelligence, Audio, Automotive, Health Care, Homeland Security, Intelligent Systems, Internet of Things, Security, Sensor","Tel Aviv-yafo, Tel Aviv, Israel",,2015-12-23,day,,,2018-09-12,15000,USD,15000,Grant,450000,USD,450000,Seed,Israel Innovation Authority,1
strongDM,https://www.crunchbase.com/organization/strongdm,"Security, Software","Burlingame, California, United States","San Francisco Bay Area, West Coast, Western US",2012-01-01,year,,,2018-10-12,1000000,USD,1000000,Seed,1000000,USD,1000000,Seed,"Bloomberg Beta, Data Collective DCVC, Hearst Communications, Social Starts, True Ventures",16
VAAK,https://www.crunchbase.com/organization/vaak,"Automotive, Retail Technology, Security, Smart Cities","Tokyo, Tokyo, Japan",Asia-Pacific (APAC),,,,,2018-10-01,,,,Series A,,,,Early Stage Venture,Deepcore,1
Devcon Detect,https://www.crunchbase.com/organization/dev-con-detect,"Artificial Intelligence, Cyber Security, FinTech, Fraud Detection, Information Technology","Memphis, Tennessee, United States",Southern US,2017-05-01,day,,,2018-12-19,4500000,USD,4500000,Seed,4500000,USD,4500000,Seed,"BIP Capital, Golden Seeds, Newfund Capital, Service Provider Capital, Techstars",20
Censys,https://www.crunchbase.com/organization/censys,"Cyber Security, Internet, Search Engine, Security","Ann Arbor, Michigan, United States","Great Lakes, Midwestern US",2017-01-01,year,,,2018-11-27,2600000,USD,2600000,Seed,2600000,USD,2600000,Seed,"Greylock Partners, GV, HD Moore, Mango Capital",4
Coinmine,https://www.crunchbase.com/organization/coinmine,"Cryptocurrency, Hardware, Mining","West Hollywood, California, United States","Greater Los Angeles Area, West Coast, Western US",,,,,2018-11-15,2000000,USD,2000000,Seed,2000000,USD,2000000,Seed,"Republic Labs, Visary Capital",2
Project Provenance,https://www.crunchbase.com/organization/provenance,"Blockchain, FinTech, Information Technology, Retail Technology, SaaS, Social Impact, Supply Chain Management","London, England, United Kingdom",European Union (EU),2014-09-01,day,,,2018-07-18,,,,Venture - Series Unknown,,,,,"Digital Currency Group, Innovate UK, Peter Gabriel, Plug and Play, Wayra",11
Skopenow,https://www.crunchbase.com/organization/skopenow,"Analytics, Enterprise Software, Fraud Detection, InsurTech, Risk Management, SaaS, Search Engine, Security, Visual Search","New York, New York, United States","Greater New York Area, East Coast, Northeastern US",2016-07-01,day,,,2018-10-31,2500000,USD,2500000,Venture - Series Unknown,2500000,USD,2500000,,"Colle Capital Partners, MS&AD Ventures, Sinai Ventures, Techstars, Techstars New York City Accelerator",8
Lykke AG,https://www.crunchbase.com/organization/lykke-ag,"Bitcoin, Finance, Financial Services, FinTech, Trading Platform","London, England, United Kingdom",European Union (EU),2013-09-26,day,,,2018-09-25,,,,Corporate Round,,,,,"Impact51, Tamedia",2
Trueface,https://www.crunchbase.com/organization/trueface-ai,"Artificial Intelligence, Computer Vision, Developer APIs, Facial Recognition, Machine Learning, Security","Santa Monica, California, United States","Greater Los Angeles Area, West Coast, Western US",2017-06-28,day,,,2018-08-07,1250000,USD,1250000,Seed,1250000,USD,1250000,Seed,"500 Startups, Alex Bogusky, Boomtown Accelerators, GrowthX, Scout Ventures",11
Trust Stamp,https://www.crunchbase.com/organization/trust-stamp,"Biometrics, FinTech, Fraud Detection, Identity Management, Personal Finance, Transaction Processing","Atlanta, Georgia, United States","Greater Atlanta Area, East Coast, Southern US",2015-11-07,day,,,2018-09-25,3000000,USD,3000000,Seed,3000000,USD,3000000,Seed,"Dan Roselli, Emergent Technology Holdings, Queen City Fintech, Second Century Ventures, SixThirty CYBER",7
TrueVault,https://www.crunchbase.com/organization/truevault,"Cloud Computing, Enterprise Software, Health Care, mHealth, Security","Palo Alto, California, United States","San Francisco Bay Area, Silicon Valley, West Coast",2013-01-01,year,,,2018-08-24,3717000,USD,3717000,Venture - Series Unknown,3717000,USD,3717000,,"CRCM Ventures, FundersClub, Pegasus Tech Ventures, Tech Coast Angels, Y Combinator",13
Portshift,https://www.crunchbase.com/organization/portshift,"Cloud Computing, Cloud Management, Cloud Security, IT Management","Tel Aviv, Tel Aviv, Israel",,2018-04-01,month,,,2018-11-20,5300000,USD,5300000,Seed,5300000,USD,5300000,Seed,,
Lucidity,https://www.crunchbase.com/organization/kr8os,"Advertising, Advertising Platforms, Analytics, Blockchain, Mobile Advertising","Marina Del Rey, California, United States","Greater Los Angeles Area, West Coast, Western US",2017-08-01,month,,,2018-08-15,5000000,USD,5000000,Corporate Round,5000000,USD,5000000,,"3Rodeo, CoinUs, Cypher Group, Pithia, Youbi Capital",5
PatternEx,https://www.crunchbase.com/organization/patternex,"Artificial Intelligence, Information Technology, Security, Software","San Jose, California, United States","San Francisco Bay Area, Silicon Valley, West Coast",2013-01-01,year,,,2018-08-01,,,,Venture - Series Unknown,,,,,"CTW Venture Partners, Khosla Ventures, Monta Vista Capital, Scott Banister, SixThirty CYBER",6
CASPIAN,https://www.crunchbase.com/organization/caspian-dc20,"Asset Management, Cryptocurrency, FinTech, SaaS","San Francisco, California, United States","San Francisco Bay Area, West Coast, Western US",2018-01-01,year,,,2018-09-17,19500000,USD,19500000,Initial Coin Offering,19500000,USD,19500000,,"Galaxy Investment Partners, Kenetic, Kinetic, Octagon Strategy, Techemy Capital",5
Tascent,https://www.crunchbase.com/organization/tascenthttp-www-tascent-com,"Biometrics, Identity Management","Los Gatos, California, United States","San Francisco Bay Area, Silicon Valley, West Coast",2015-01-01,year,,,2018-08-28,19500000,USD,19500000,Series B,19500000,USD,19500000,Early Stage Venture,"Min Aik Technology, NEC Corporation, Tano Capital",3
Votiro,https://www.crunchbase.com/organization/votiro,"Cyber Security, Health Care, Security","Tel Aviv, Tel Aviv, Israel",,2009-01-01,year,,,2018-11-14,8000000,USD,8000000,Series B,8000000,USD,8000000,Early Stage Venture,"Divergent Group, Redfield Asset Management, Senetas",3
ZenSports,https://www.crunchbase.com/organization/zensports,"Blockchain, Cryptocurrency, Gambling, Mobile Apps, Sports","San Francisco, California, United States","San Francisco Bay Area, West Coast, Western US",2016-11-01,month,,,2018-09-28,402850,USD,402850,Pre-Seed,402850,USD,402850,Seed,"Acceleprise, Right Side Capital Management",2
MoonX,https://www.crunchbase.com/organization/moonx,"Blockchain, Cryptocurrency, Venture Capital","Geneva, Geneve, Switzerland",,2017-01-01,year,,,2018-07-26,29000000,USD,29000000,Venture - Series Unknown,29000000,USD,29000000,,"Bitmain, DHVC, IDG Capital, NEO Global Capital (NGC), Node Capital",10
NuID,https://www.crunchbase.com/organization/nuid-inc,"Blockchain, Cyber Security, Identity Management, Network Security, Security, Software","San Francisco, California, United States","San Francisco Bay Area, West Coast, Western US",2017-04-19,day,,,2018-12-13,2500000,USD,2500000,Seed,2500000,USD,2500000,Seed,"8VC, Jemison Investment Company, Kairos",3
